,id_sinistro,tipo_registro,data_sinistro,ano_sinistro,mes_sinistro,dia_sinistro,ano_mes_sinistro,hora_sinistro,logradouro,numero_logradouro,tipo_via,latitude,longitude,municipio,regiao_administrativa,tp_veiculo_bicicleta,tp_veiculo_caminhao,tp_veiculo_motocicleta,tp_veiculo_nao_disponivel,tp_veiculo_onibus,tp_veiculo_outros,tp_veiculo_automovel,gravidade_nao_disponivel,gravidade_leve,gravidade_fatal,gravidade_ileso,gravidade_grave,administracao,conservacao,jurisdicao,tipo_acidente_primario,tp_sinistro_atropelamento,tp_sinistro_colisao_frontal,tp_sinistro_colisao_traseira,tp_sinistro_colisao_lateral,tp_sinistro_colisao_transversal,tp_sinistro_colisao_outros,tp_sinistro_choque,tp_sinistro_capotamento,tp_sinistro_engavetamento,tp_sinistro_tombamento,tp_sinistro_outros,tp_sinistro_nao_disponivel,acidente_grave
394645,1740649,SINISTRO NAO FATAL,21/12/2023,2023,12,21,2023/12,23:54,AVENIDA RAGUEB CHOHFI,4285.0,VIAS MUNICIPAIS,-23.5944347,-46.4440366,SAO PAULO,Metropolitana de São Paulo,,,,,,,1.0,1.0,,,,,PREFEITURA,PREFEITURA,MUNICIPAL,OUTROS,,,,,,,,S,,,,,0
632017,2559727,SINISTRO NAO FATAL,15/03/2025,2025,3,15,2025/03,11:05,SP 075,9.0,RODOVIAS,-23.43089516,-47.36680009,SOROCABA,Sorocaba,,,,,,,,,,,,,CONCESSIONÁRIA,VIAOESTE,ESTADUAL,OUTROS,,,,,,,,,,S,,,0
53273,1893055,SINISTRO NAO FATAL,19/04/2022,2022,4,19,2022/04,09:00,AVENIDA JOSÉ MARIA MARQUÊS DE OLIVEIRA,918.0,VIAS MUNICIPAIS,-23.17593701,-47.31259132,SALTO,Sorocaba,,,,,,,1.0,,1.0,,,,PREFEITURA,PREFEITURA,MUNICIPAL,COLISAO,,,,S,,,,,,,,,0
632120,2565755,SINISTRO NAO FATAL,15/03/2025,2025,3,15,2025/03,17:02,AVENIDA DOUTOR JOSE ANIBAL SOARES DE OLIVEIRA,320.0,VIAS MUNICIPAIS,-20.3360444,-47.7833539,ITUVERAVA,Franca,,,,,,,,,,,,,PREFEITURA,PREFEITURA,MUNICIPAL,COLISAO,,S,,,,,,,,,,,0
335246,1847646,SINISTRO NAO FATAL,12/09/2023,2023,9,12,2023/09,06:27,RUA SOUSA COUTINHO,400.0,VIAS MUNICIPAIS,-23.611965,-46.5965,SAO PAULO,Metropolitana de São Paulo,,,1.0,1.0,,,,,1.0,,,,PREFEITURA,PREFEITURA,MUNICIPAL,COLISAO,,,,S,,,,,,,,,0
527803,2382271,SINISTRO NAO FATAL,19/08/2024,2024,8,19,2024/08,21:21,AVENIDA CORONEL SEZEFREDO FAGUNDES,2216.0,VIAS MUNICIPAIS,-23.4597771,-46.6024318,SAO PAULO,Metropolitana de São Paulo,,,2.0,,,,,1.0,1.0,,,,PREFEITURA,PREFEITURA,MUNICIPAL,COLISAO,,,S,,,,,,,,S,,0
556062,2409424,NOTIFICACAO,10/10/2024,2024,10,10,2024/10,16:05,RUA CARIOBA,1.0,VIAS MUNICIPAIS,-22.7368631,-47.3295647,AMERICANA,Campinas,,,,,,,,,,,,,PREFEITURA,PREFEITURA,MUNICIPAL,OUTROS,,,,,,,,,,,S,,0
637603,2577749,SINISTRO NAO FATAL,26/03/2025,2025,3,26,2025/03,16:00,RUA PADRE ROQUE,78.0,VIAS MUNICIPAIS,-22.4340024,-46.9591149,MOGI MIRIM,Campinas,,,,,,,,,,,,,PREFEITURA,PREFEITURA,MUNICIPAL,COLISAO,,S,,,,,,,,,,,0
314453,1521713,NOTIFICACAO,09/08/2023,2023,8,9,2023/08,19:04,ELIESER MONTENEGRO MAGALHAES,46.0,VIAS MUNICIPAIS,-21.18731,-50.468716,ARACATUBA,Araçatuba,,,,,,,,,,,,,PREFEITURA,PREFEITURA,MUNICIPAL,OUTROS,,,,,,,,,,,S,,0
342287,2498047,SINISTRO FATAL,24/09/2023,2023,9,24,2023/09,22:20,SP 332,121.8,RODOVIAS,-22.7946762826,-47.1351031439,PAULINIA,Campinas,,,1.0,,,,1.0,1.0,,1.0,,,CONCESSIONÁRIA,ROTA DAS BANDEIRAS,ESTADUAL,COLISAO,,S,,,,,,,,,,S,1
263513,1378889,SINISTRO NAO FATAL,18/05/2023,2023,5,18,2023/05,17:12,AVENIDA DO ESTADO,1.0,VIAS MUNICIPAIS,-23.56215467,-46.6124739,SAO PAULO,Metropolitana de São Paulo,,,1.0,,,,,1.0,1.0,,,,PREFEITURA,PREFEITURA,MUNICIPAL,ATROPELAMENTO,S,,,,,,,,,,S,,0
576628,2453738,NOTIFICACAO,17/11/2024,2024,11,17,2024/11,06:49,AVENIDA DO ESTADO,100.0,VIAS MUNICIPAIS,-23.5628021,-46.6123175,SAO PAULO,Metropolitana de São Paulo,,,,,,,,,,,,,PREFEITURA,PREFEITURA,MUNICIPAL,NAO DISPONIVEL,,,,,,,,,,,,S,0
405875,1628116,SINISTRO NAO FATAL,12/01/2024,2024,1,12,2024/01,20:00,SP 322,391.0,RODOVIAS,-20.9237852,-48.5289673,BEBEDOURO,Barretos,,,,,,,1.0,,1.0,,,,DER,14.02,ESTADUAL,CHOQUE,,,,,,,S,,,,,,0
604651,2511974,NOTIFICACAO,15/01/2025,2025,1,15,2025/01,17:36,AVENIDA PADRE ANCHIETA,1623.0,VIAS MUNICIPAIS,-24.3179106,-46.9939197,PERUIBE,Baixada Santista,,,,,,,,1.0,1.0,,,,PREFEITURA,PREFEITURA,MUNICIPAL,ATROPELAMENTO,S,,,,,,,,,,,,0
614018,2554139,NOTIFICACAO,06/02/2025,2025,2,6,2025/02,07:10,RUA  CARATAIS,10.0,VIAS MUNICIPAIS,-23.6991112,-46.6465604,SAO PAULO,Metropolitana de São Paulo,,,,,,,,,,,,,PREFEITURA,PREFEITURA,MUNICIPAL,ATROPELAMENTO,S,,,,,,,,,,,,0
603979,2523570,SINISTRO NAO FATAL,13/01/2025,2025,1,13,2025/01,10:01,AVENIDA EDSON DANILO DOTTO,100.0,VIAS MUNICIPAIS,-23.6605142,-46.5284981,SANTO ANDRE,Metropolitana de São Paulo,,,,,,,1.0,1.0,,,,,PREFEITURA,PREFEITURA,MUNICIPAL,COLISAO,,S,,,,,,,,,,,0
402120,1659995,NOTIFICACAO,05/01/2024,2024,1,5,2024/01,22:10,AVENIDA CAMPOS SALES,1.0,VIAS MUNICIPAIS,-22.7404977,-47.3352218,AMERICANA,Campinas,,,,,,,,,,,,,PREFEITURA,PREFEITURA,MUNICIPAL,OUTROS,,,,,,,,,,,S,,0
646406,2588244,SINISTRO NAO FATAL,12/04/2025,2025,4,12,2025/04,01:39,AVENIDA NORDESTINA,4159.0,VIAS MUNICIPAIS,-23.5155968,-46.4233686,SAO PAULO,Metropolitana de São Paulo,,,,,,,2.0,,,,,,PREFEITURA,PREFEITURA,MUNICIPAL,COLISAO,,S,,S,,,,,,,,,0
253505,1827379,NOTIFICACAO,30/04/2023,2023,4,30,2023/04,22:49,R PARAMU  VILA PRUDENTE  R PARAMU,100.0,VIAS MUNICIPAIS,-23.5962944,-46.56779,SAO PAULO,Metropolitana de São Paulo,,,,,,,,,,,,,PREFEITURA,PREFEITURA,MUNICIPAL,ATROPELAMENTO,S,,,,,,,,,,,S,0
280413,2213418,SINISTRO NAO FATAL,13/06/2023,2023,6,13,2023/06,12:18,RUA CORONEL MEIRELES,718.0,VIAS MUNICIPAIS,-23.51686,-46.535465,SAO PAULO,Metropolitana de São Paulo,,,1.0,,,,1.0,1.0,1.0,,,,PREFEITURA,PREFEITURA,MUNICIPAL,COLISAO,,,,S,,,,,,,S,,0
43926,1339375,NOTIFICACAO,02/04/2022,2022,4,2,2022/04,00:40,RUA AMERICO SUGAI,10.0,VIAS MUNICIPAIS,-23.50097384,-46.45486461,SAO PAULO,Metropolitana de São Paulo,,,,,,,,,,,,,PREFEITURA,PREFEITURA,MUNICIPAL,OUTROS,,,,,,,,,,,S,,0
235927,2204274,SINISTRO NAO FATAL,29/03/2023,2023,3,29,2023/03,12:40,SP 160,42.0,RODOVIAS,-23.90983872,-46.55819377,SAO BERNARDO DO CAMPO,Metropolitana de São Paulo,,,1.0,,,,,,2.0,,,,DER,10.01,ESTADUAL,OUTROS,,,,,,,,,,S,,,0
410033,1531581,SINISTRO NAO FATAL,20/01/2024,2024,1,20,2024/01,15:50,JOAO EMILIO RODER,1.0,VIAS MUNICIPAIS,-23.0963754,-48.390903,PARDINHO,Sorocaba,,,1.0,,,,1.0,1.0,1.0,,,,PREFEITURA,PREFEITURA,MUNICIPAL,COLISAO,,,,,S,,,,,,,,0
370017,1793925,SINISTRO NAO FATAL,11/11/2023,2023,11,11,2023/11,19:19,JOSE MARIA ALBUQUERQUE,1.0,VIAS MUNICIPAIS,-20.9641895,-49.02560174,TABAPUA,São José do Rio Preto,,,1.0,,,,1.0,,1.0,,,,PREFEITURA,PREFEITURA,MUNICIPAL,COLISAO,,,S,,,,,,,,,,0
326651,1405775,NOTIFICACAO,29/08/2023,2023,8,29,2023/08,16:52,AVENIDA PAULISTA,1.0,VIAS MUNICIPAIS,-22.97552279,-46.9896014,VALINHOS,Campinas,,,,,,,,,,,,,PREFEITURA,PREFEITURA,MUNICIPAL,NAO DISPONIVEL,,,,,,,,,,,,S,0
220324,2139199,SINISTRO NAO FATAL,28/02/2023,2023,2,28,2023/02,12:29,RUA DOUTOR JESUINO MACIEL,1407.0,VIAS MUNICIPAIS,-23.62227659,-46.66813438,SAO PAULO,Metropolitana de São Paulo,,,1.0,,,,1.0,1.0,1.0,,,,PREFEITURA,PREFEITURA,MUNICIPAL,COLISAO,,S,,,,,,,,,,,0
467893,2337983,SINISTRO NAO FATAL,04/05/2024,2024,5,4,2024/05,09:16,RUA ANA MARIA NARDO SILVA,744.0,VIAS MUNICIPAIS,-23.1979827,-45.9115497,SAO JOSE DOS CAMPOS,São José dos Campos,,,,,,1.0,1.0,1.0,1.0,,,,PREFEITURA,PREFEITURA,MUNICIPAL,COLISAO,,S,,,,,,,,,,,0
608036,2509602,SINISTRO NAO FATAL,23/01/2025,2025,1,23,2025/01,16:24,AVENIDA CONSELHEIRO NEBIAS,488.0,VIAS MUNICIPAIS,-23.9551006,-46.322792,SANTOS,Baixada Santista,,,1.0,,,,1.0,1.0,1.0,,,,PREFEITURA,PREFEITURA,MUNICIPAL,COLISAO,,,,S,,,,,,,,,0
88249,1955899,SINISTRO NAO FATAL,22/06/2022,2022,6,22,2022/06,08:01,RUA 18,100.0,VIAS MUNICIPAIS,-22.40839359,-47.57486846,RIO CLARO,Campinas,1.0,,1.0,1.0,,,,,2.0,,,,PREFEITURA,PREFEITURA,MUNICIPAL,CHOQUE,,,,,,,S,,,,S,,0
493744,2356630,SINISTRO NAO FATAL,18/06/2024,2024,6,18,2024/06,10:31,AVENIDA VITÓRIA RÉGIA,3078.0,VIAS MUNICIPAIS,-21.2827127,-50.3182647,BIRIGUI,Araçatuba,,,2.0,,,,,2.0,1.0,,,,PREFEITURA,PREFEITURA,MUNICIPAL,COLISAO,,,,S,S,,,,,,S,,0
665334,2602168,SINISTRO NAO FATAL,19/05/2025,2025,5,19,2025/05,22:50,RUA MARECHAL DEODORO,1.0,VIAS MUNICIPAIS,-21.2582734,-50.6357661,GUARARAPES,Araçatuba,,,1.0,,,,1.0,1.0,2.0,,,,PREFEITURA,PREFEITURA,MUNICIPAL,COLISAO,,,,S,,,,,,,,,0
29557,1713921,NOTIFICACAO,05/03/2022,2022,3,5,2022/03,17:41,"PRAÇA DR  NARCIZO GOMES,",49.0,VIAS MUNICIPAIS,-22.3738267,-47.41260193,ARARAS,Campinas,,,,,,,,,,,,,PREFEITURA,PREFEITURA,MUNICIPAL,NAO DISPONIVEL,,,,,,,,,,,,S,0
196820,1966858,SINISTRO NAO FATAL,12/01/2023,2023,1,12,2023/01,08:52,RUA AFONSO PENA,10.0,VIAS MUNICIPAIS,-21.30019881,-50.33169354,BIRIGUI,Araçatuba,,,1.0,,,,1.0,1.0,1.0,,,,PREFEITURA,PREFEITURA,MUNICIPAL,COLISAO,,,,S,,,,,,,S,,0
290131,1902249,SINISTRO NAO FATAL,29/06/2023,2023,6,29,2023/06,07:44,SP 099,1000.0,RODOVIAS,-23.44205288,-46.91937087,SANTANA DE PARNAIBA,Metropolitana de São Paulo,,,,,,,1.0,1.0,1.0,,,,DER,10.03,ESTADUAL,COLISAO,,,S,,,,,,,,,,0
97559,1698379,SINISTRO NAO FATAL,09/07/2022,2022,7,9,2022/07,16:27,RUA DAS PEROBAS,295.0,VIAS MUNICIPAIS,-23.64340378,-46.64275715,SAO PAULO,Metropolitana de São Paulo,,,,,,,1.0,2.0,1.0,,,,PREFEITURA,PREFEITURA,MUNICIPAL,ATROPELAMENTO,S,,,,,,,,,,,,0
359127,2041835,NOTIFICACAO,23/10/2023,2023,10,23,2023/10,08:26,ESTRADA DE ITAPECERICA,160.0,VIAS MUNICIPAIS,-23.6408836,-46.7385591,SAO PAULO,Metropolitana de São Paulo,,,,,,,,,,,,,PREFEITURA,PREFEITURA,MUNICIPAL,OUTROS,,,,,,,,,,,S,S,0
166304,1564562,SINISTRO NAO FATAL,13/11/2022,2022,11,13,2022/11,13:51,RUA MIGUEL TORGA,100.0,VIAS MUNICIPAIS,-23.29482483,-45.92755717,JACAREI,São José dos Campos,,,,,,,1.0,4.0,1.0,,,,PREFEITURA,PREFEITURA,MUNICIPAL,OUTROS,,,,,,,,,,,S,,0
221400,1489559,SINISTRO NAO FATAL,02/03/2023,2023,3,2,2023/03,18:42,"CENTRO CULTURAL SÃO PAULO  RUA VERGUEIRO, 1000",0.0,VIAS MUNICIPAIS,-23.5711136,-46.64013,SAO PAULO,Metropolitana de São Paulo,,,1.0,,,,1.0,1.0,,,,1.0,PREFEITURA,PREFEITURA,MUNICIPAL,COLISAO,,,,S,,,,,,,S,,1
8746,2281402,NOTIFICACAO,23/01/2022,2022,1,23,2022/01,11:48,AVENIDA DOUTOR FRANCISCO JUNQUEIRA,0.0,VIAS MUNICIPAIS,-21.18850938,-47.7977309,RIBEIRAO PRETO,Ribeirão Preto,,,,,,,,,,,,,PREFEITURA,PREFEITURA,MUNICIPAL,OUTROS,,,,,,,,,,,S,S,0
121516,1907248,NOTIFICACAO,22/08/2022,2022,8,22,2022/08,07:45,AV ENG RONALDO ALGODOAL GUEDES PEREIRA,101.0,VIAS MUNICIPAIS,-22.3674207,-46.94916115,MOGI GUACU,Campinas,,,,,,,,,,,,,PREFEITURA,PREFEITURA,MUNICIPAL,OUTROS,,,,,,,,,,,S,,0
421015,2489740,SINISTRO FATAL,10/02/2024,2024,2,10,2024/02,23:15,SP 055,284.5,RODOVIAS,-23.9790075885,-46.4846112621,SAO VICENTE,Baixada Santista,,,,,,,1.0,,,1.0,,,CONCESSIONÁRIA,ECOVIAS,ESTADUAL,ATROPELAMENTO,S,,,,,,,,,,,S,1
587227,2413044,NOTIFICACAO,07/12/2024,2024,12,7,2024/12,10:55,RUA ALBERTO AMADOR,1247.0,VIAS MUNICIPAIS,-22.53569254,-52.17560441,TEODORO SAMPAIO,Presidente Prudente,,,,,,,,,,,,,PREFEITURA,PREFEITURA,MUNICIPAL,NAO DISPONIVEL,,,,,,,,,,,,S,0
292469,1385964,SINISTRO NAO FATAL,03/07/2023,2023,7,3,2023/07,16:00,SP 340,99.0,RODOVIAS,-22.4731617,-47.1242881,CAMPINAS,Campinas,,,1.0,,,,,,,,,1.0,CONCESSIONÁRIA,RENOVIAS,ESTADUAL,COLISAO,,,S,,,,,,,S,,,1
400231,1692888,NOTIFICACAO,01/01/2024,2024,1,1,2024/01,15:30,RUA SANTA BÁRBARA,781.0,VIAS MUNICIPAIS,-24.0410782,-46.5194774,PRAIA GRANDE,Baixada Santista,,,,,,,,,,,,,PREFEITURA,PREFEITURA,MUNICIPAL,OUTROS,,,,,,,,,,,S,S,0
371418,1636610,SINISTRO NAO FATAL,13/11/2023,2023,11,13,2023/11,17:56,AVENIDA ANTONELO DA MESSINA,98.0,VIAS MUNICIPAIS,-23.4556286,-46.5898407,SAO PAULO,Metropolitana de São Paulo,,,,2.0,,,,1.0,,,,,PREFEITURA,PREFEITURA,MUNICIPAL,OUTROS,,,,,,,,,,,S,,0
86331,1407566,SINISTRO NAO FATAL,18/06/2022,2022,6,18,2022/06,14:27,RUA PADRE MACHADO,62.0,VIAS MUNICIPAIS,-23.60151363,-46.63617612,SAO PAULO,Metropolitana de São Paulo,,,1.0,,,1.0,,3.0,2.0,,,,PREFEITURA,PREFEITURA,MUNICIPAL,ATROPELAMENTO,S,,,,,,,,,,S,,0
487847,2305514,NOTIFICACAO,08/06/2024,2024,6,8,2024/06,21:12,OMERE SEVERO  LINS,530.0,VIAS MUNICIPAIS,-22.23559409,-50.88990598,RANCHARIA,Presidente Prudente,,,,,,,,,,,,,PREFEITURA,PREFEITURA,MUNICIPAL,OUTROS,,,,,,,,,,,S,,0
448150,1666647,SINISTRO NAO FATAL,30/03/2024,2024,3,30,2024/03,18:10,AVENIDA MIRASSOLÂNDIA,10.0,VIAS MUNICIPAIS,-20.78586957,-49.39165603,SAO JOSE DO RIO PRETO,São José do Rio Preto,,,1.0,,,,1.0,1.0,1.0,,,,PREFEITURA,PREFEITURA,MUNICIPAL,COLISAO,,,,S,,,,,,,,,0
478959,2373105,SINISTRO NAO FATAL,23/05/2024,2024,5,23,2024/05,15:11,RUA OSWALDO CRUZ,340.0,VIAS MUNICIPAIS,-23.9653939,-46.3219412,SANTOS,Baixada Santista,,,1.0,,,,1.0,1.0,1.0,,,,PREFEITURA,PREFEITURA,MUNICIPAL,COLISAO,,,,,S,,,,,,,,0
215596,1968920,SINISTRO NAO FATAL,18/02/2023,2023,2,18,2023/02,04:42,CURVA DO MOSTEIRINHO,100.0,VIAS MUNICIPAIS,-23.712308,-49.5001683,ITAPORANGA,Itapeva,,,,,,,1.0,1.0,1.0,,,,PREFEITURA,PREFEITURA,MUNICIPAL,OUTROS,,,,,,,,,,S,,,0
230410,1510265,SINISTRO NAO FATAL,19/03/2023,2023,3,19,2023/03,13:46,AVENIDA CARMINÉ GRAGNANO,798.0,VIAS MUNICIPAIS,-23.5299015,-46.89798069,JANDIRA,Metropolitana de São Paulo,,,,,1.0,,,1.0,1.0,,,,PREFEITURA,PREFEITURA,MUNICIPAL,COLISAO,,S,,,,,,,,,,,0
394627,1305707,NOTIFICACAO,21/12/2023,2023,12,21,2023/12,15:06,RUA VINÍCIUS DE MORÃES,380.0,VIAS MUNICIPAIS,-22.8436817,-47.1595553,SUMARE,Campinas,,,,,,,,,,,,,PREFEITURA,PREFEITURA,MUNICIPAL,NAO DISPONIVEL,,,,,,,,,,,,S,0
423288,1939490,SINISTRO NAO FATAL,14/02/2024,2024,2,14,2024/02,07:06,AVENIDA PADRE LEBRET,300.0,VIAS MUNICIPAIS,-23.6017107,-46.7136414,SAO PAULO,Metropolitana de São Paulo,,,1.0,,1.0,,2.0,3.0,1.0,,,,PREFEITURA,PREFEITURA,MUNICIPAL,COLISAO,,S,,S,,,,,,,,,0
467223,2359130,NOTIFICACAO,03/05/2024,2024,5,3,2024/05,11:48,AVENIDA COMENDADOR DANTE CARRARO,1240.0,VIAS MUNICIPAIS,-23.5308196,-46.8538414,CARAPICUIBA,Metropolitana de São Paulo,,,,,,,,,,,,,PREFEITURA,PREFEITURA,MUNICIPAL,NAO DISPONIVEL,,,,,,,,,,,,S,0
672119,2601261,SINISTRO NAO FATAL,31/05/2025,2025,5,31,2025/05,18:48,AVENIDA PRESIDENTE VARGAS,10.0,VIAS MUNICIPAIS,-21.7688905,-52.1120413,PRESIDENTE EPITACIO,Presidente Prudente,,1.0,,,,1.0,1.0,1.0,1.0,,,,PREFEITURA,PREFEITURA,MUNICIPAL,COLISAO,,,,,S,,,,,,,,0
398022,1433091,SINISTRO NAO FATAL,27/12/2023,2023,12,27,2023/12,18:04,AVENIDA PEREIRA BARRETO,2034.0,VIAS MUNICIPAIS,-23.682097,-46.5434114,SANTO ANDRE,Metropolitana de São Paulo,,,1.0,,,,1.0,2.0,1.0,,,,PREFEITURA,PREFEITURA,MUNICIPAL,COLISAO,,,,S,,,,,,,S,,0
241835,2161508,SINISTRO NAO FATAL,09/04/2023,2023,4,9,2023/04,06:12,RUA PRUDENTE DE MORÃES,251.0,VIAS MUNICIPAIS,-22.84190413,-47.60497183,RIO DAS PEDRAS,Campinas,,,,,,,1.0,,1.0,,,,PREFEITURA,PREFEITURA,MUNICIPAL,CHOQUE,,,,,,,S,,,,,,0
119816,2191507,SINISTRO NAO FATAL,19/08/2022,2022,8,19,2022/08,12:35,AVENIDA BRIGADEIRO LUIS ANTONIO,4980.0,VIAS MUNICIPAIS,-23.57920514,-46.66164148,SAO PAULO,Metropolitana de São Paulo,,,1.0,,,,1.0,2.0,1.0,,,,PREFEITURA,PREFEITURA,MUNICIPAL,COLISAO,,S,,,,,,,,,S,,0
557330,2420915,SINISTRO NAO FATAL,12/10/2024,2024,10,12,2024/10,14:46,AVENIDA NOSSA SENHORA DE FÁTIMA,1856.0,VIAS MUNICIPAIS,-22.7447847,-47.3078119,AMERICANA,Campinas,,,1.0,,,,1.0,1.0,1.0,,,,PREFEITURA,PREFEITURA,MUNICIPAL,COLISAO,,,S,,,,,,,,S,,0
488865,2306561,SINISTRO NAO FATAL,10/06/2024,2024,6,10,2024/06,21:14,RUA BARTIRA,275.0,VIAS MUNICIPAIS,-23.2804374,-47.2842275,ITU,Sorocaba,,,,,,,1.0,,1.0,,,,PREFEITURA,PREFEITURA,MUNICIPAL,CHOQUE,,,,,,,S,,,,,,0
429613,2536612,SINISTRO NAO FATAL,25/02/2024,2024,2,25,2024/02,00:00,RUA OLINDA ROSA ALVES DE MELLO,476.0,VIAS MUNICIPAIS,-211492.0,-479603.0,SERTAOZINHO,Ribeirão Preto,,,,1.0,,,,1.0,,,,,PREFEITURA,PREFEITURA,MUNICIPAL,OUTROS,,,,,,,,,,,S,,0
643422,2587681,NOTIFICACAO,06/04/2025,2025,4,6,2025/04,20:56,GUARULHOSNAZARE,1750.0,VIAS MUNICIPAIS,-23.4359546,-46.46457683,GUARULHOS,Metropolitana de São Paulo,,,,,,,,,,,,,PREFEITURA,PREFEITURA,MUNICIPAL,NAO DISPONIVEL,,,,,,,,,,,,S,0
449588,1510302,NOTIFICACAO,02/04/2024,2024,4,2,2024/04,18:29,SP 300,600.0,RODOVIAS,-20.8859061,-51.3643296,ANDRADINA,Araçatuba,,,,,,,,,,,,,DER,11.03,ESTADUAL,NAO DISPONIVEL,,,,,,,,,,,,S,0
466320,2362279,SINISTRO NAO FATAL,02/05/2024,2024,5,2,2024/05,00:34,RUA CRISTÓBAL CLÁUDIO ELILO,10.0,VIAS MUNICIPAIS,-23.4537498,-46.4997576,GUARULHOS,Metropolitana de São Paulo,,,1.0,,,,1.0,2.0,1.0,,,,PREFEITURA,PREFEITURA,MUNICIPAL,COLISAO,,S,,,,,,,,,,,0
255254,1269404,NOTIFICACAO,04/05/2023,2023,5,4,2023/05,14:20,AVENIDA ARGEMIRO BALBO,530.0,VIAS MUNICIPAIS,-21.12101317,-48.00836325,SERTAOZINHO,Ribeirão Preto,,,,,,,,,,,,,PREFEITURA,PREFEITURA,MUNICIPAL,NAO DISPONIVEL,,,,,,,,,,,,S,0
328833,1714698,SINISTRO NAO FATAL,02/09/2023,2023,9,2,2023/09,21:38,AVENIDA ALCÂNTARA MACHADO,638.0,VIAS MUNICIPAIS,-23.553028,-46.618534,SAO PAULO,Metropolitana de São Paulo,,,1.0,,,,,,1.0,,,,PREFEITURA,PREFEITURA,MUNICIPAL,OUTROS,,,,,,,,,,,S,,0
370493,2148874,NOTIFICACAO,11/11/2023,2023,11,11,2023/11,08:22,RUA SERAPHIM BANIETTI,1095.0,VIAS MUNICIPAIS,-23.4513792,-47.4967002,SOROCABA,Sorocaba,,,,,,,,,,,,,PREFEITURA,PREFEITURA,MUNICIPAL,OUTROS,,,,,,,,,,,S,,0
129774,1407283,NOTIFICACAO,06/09/2022,2022,9,6,2022/09,18:14,AVENIDA REBOUCAS,2593.0,VIAS MUNICIPAIS,-23.5675821,-46.68414683,SAO PAULO,Metropolitana de São Paulo,,,,,,,,,,,,,PREFEITURA,PREFEITURA,MUNICIPAL,OUTROS,,,,,,,,,,,S,,0
283721,1610337,NOTIFICACAO,19/06/2023,2023,6,19,2023/06,19:20,RUA ATIBAIA,255.0,VIAS MUNICIPAIS,-22.347553,-46.944458,MOGI GUACU,Campinas,,,,,,,,,,,,,PREFEITURA,PREFEITURA,MUNICIPAL,OUTROS,,,,,,,,,,,S,,0
329993,1449379,SINISTRO NAO FATAL,04/09/2023,2023,9,4,2023/09,15:08,RUA ALFREDO ALBERTINE,308.0,VIAS MUNICIPAIS,-23.95330219,-46.34654039,SANTOS,Baixada Santista,,1.0,,1.0,,,,2.0,1.0,,,,PREFEITURA,PREFEITURA,MUNICIPAL,OUTROS,,,,,,,,,,,S,,0
379180,2491256,SINISTRO FATAL,27/11/2023,2023,11,27,2023/11,00:07,AVENIDA JOÃO VENTURA DOS SANTOS,1136.0,VIAS MUNICIPAIS,-23.4963931287,-46.7915613089,OSASCO,Metropolitana de São Paulo,,,1.0,,,,,2.0,,1.0,,,PREFEITURA,PREFEITURA,MUNICIPAL,CHOQUE,,,,,,,S,,,,,S,1
215810,1309433,SINISTRO NAO FATAL,18/02/2023,2023,2,18,2023/02,11:40,ACESSO AVENIDA HENRIQUE ROBERTO GUILHERME A BRECH,1335.0,VIAS MUNICIPAIS,-22.71996074,-47.29414622,AMERICANA,Campinas,,,1.0,,,,1.0,1.0,1.0,,,,PREFEITURA,PREFEITURA,MUNICIPAL,CHOQUE,,,,,,,S,,,,S,,0
204121,1655592,SINISTRO NAO FATAL,27/01/2023,2023,1,27,2023/01,21:37,RUA DOS EXPEDICIONÁRIOS,10.0,VIAS MUNICIPAIS,-22.97554551,-49.86713259,OURINHOS,Marília,,,1.0,,,,,,1.0,,,,PREFEITURA,PREFEITURA,MUNICIPAL,COLISAO,,,S,,,,,,,,,,0
209561,1580308,SINISTRO NAO FATAL,07/02/2023,2023,2,7,2023/02,21:25,ESTRADA FAZENDINHA,976.0,VIAS MUNICIPAIS,-23.56555481,-46.84592104,CARAPICUIBA,Metropolitana de São Paulo,,,,1.0,1.0,,1.0,1.0,1.0,,,,PREFEITURA,PREFEITURA,MUNICIPAL,COLISAO,,S,,S,,,,,,,S,,0
605679,2515961,SINISTRO NAO FATAL,17/01/2025,2025,1,17,2025/01,23:13,AVENIDA ERNESTO SOUZA CRUZ,1091.0,VIAS MUNICIPAIS,-23.525559,-46.4636805,SAO PAULO,Metropolitana de São Paulo,,,1.0,,,,,1.0,1.0,,,,PREFEITURA,PREFEITURA,MUNICIPAL,ATROPELAMENTO,S,,,,,,,,,,S,,0
514964,2303153,SINISTRO NAO FATAL,27/07/2024,2024,7,27,2024/07,20:16,AVENIDA RUDGE,865.0,VIAS MUNICIPAIS,-23.5208733,-46.6522231,SAO PAULO,Metropolitana de São Paulo,,,1.0,,,,1.0,1.0,1.0,,,,PREFEITURA,PREFEITURA,MUNICIPAL,COLISAO,,,,S,,,,,,,,,0
118873,2214913,NOTIFICACAO,17/08/2022,2022,8,17,2022/08,13:03,RUA BARAO DO RIO BRANCO,170.0,VIAS MUNICIPAIS,-23.64725122,-46.71027272,SAO PAULO,Metropolitana de São Paulo,,,,,,,,,,,,,PREFEITURA,PREFEITURA,MUNICIPAL,OUTROS,,,,,,,,,,,S,,0
167823,2323182,SINISTRO NAO FATAL,16/11/2022,2022,11,16,2022/11,07:57,RUA JAMIL JOÃO ZARIFE,1112.0,VIAS MUNICIPAIS,-23.423091824,-46.4916771388,GUARULHOS,Metropolitana de São Paulo,,,1.0,,,,1.0,1.0,1.0,,,,PREFEITURA,PREFEITURA,MUNICIPAL,COLISAO,,S,,,,,,,,,S,,0
426161,1386354,SINISTRO NAO FATAL,19/02/2024,2024,2,19,2024/02,15:40,AVENIDA DOUTOR FELIPE PINEL,2800.0,VIAS MUNICIPAIS,-23.4698154,-46.7362162,SAO PAULO,Metropolitana de São Paulo,,,1.0,,,,,1.0,1.0,,,,PREFEITURA,PREFEITURA,MUNICIPAL,COLISAO,,S,,,,,,,,,,,0
26055,2464171,SINISTRO FATAL,26/02/2022,2022,2,26,2022/02,22:41,AVENIDA CARLOS LACERDA,2874.0,VIAS MUNICIPAIS,-23.636632482,-46.778361152,SAO PAULO,Metropolitana de São Paulo,,,1.0,,,,1.0,,,1.0,,,PREFEITURA,PREFEITURA,MUNICIPAL,COLISAO,,,,,,S,,,,,,S,1
671200,2609103,NOTIFICACAO,29/05/2025,2025,5,29,2025/05,08:53,RUA LUCENA,18.0,VIAS MUNICIPAIS,-23.4158335,-46.4536814,GUARULHOS,Metropolitana de São Paulo,,,,,,,,,,,,,PREFEITURA,PREFEITURA,MUNICIPAL,OUTROS,,,,,,,,,,,S,,0
592400,2436769,SINISTRO NAO FATAL,17/12/2024,2024,12,17,2024/12,06:00,SP 160,43.0,RODOVIAS,-23.91871188,-46.55541035,SAO BERNARDO DO CAMPO,Metropolitana de São Paulo,,1.0,,,,1.0,1.0,1.0,1.0,,,,DER,10.01,ESTADUAL,COLISAO,,,,S,,,,,,,,,0
135497,1680521,SINISTRO NAO FATAL,17/09/2022,2022,9,17,2022/09,19:48,AVENIDA MANOEL GUIRADO,646.0,VIAS MUNICIPAIS,-22.52834326,-52.17414844,TEODORO SAMPAIO,Presidente Prudente,,1.0,,,,3.0,,1.0,1.0,,,,PREFEITURA,PREFEITURA,MUNICIPAL,ATROPELAMENTO,S,,,,,,,,,,S,S,0
121632,1551616,NOTIFICACAO,23/08/2022,2022,8,23,2022/08,17:47,ACESSO PARA MARGINAL TIETE EXPRESSA,2044.0,VIAS MUNICIPAIS,-23.53039414,-46.59156859,SAO PAULO,Metropolitana de São Paulo,,,,,,,,,,,,,PREFEITURA,PREFEITURA,MUNICIPAL,OUTROS,,,,,,,,,,,S,,0
36577,1656569,NOTIFICACAO,19/03/2022,2022,3,19,2022/03,17:03,RUA ILDA BAGNE DA SILVA,275.0,VIAS MUNICIPAIS,-22.78024791,-47.29023453,NOVA ODESSA,Campinas,,,,,,,,,,,,,PREFEITURA,PREFEITURA,MUNICIPAL,OUTROS,,,,,,,,,,,S,,0
327560,1905076,SINISTRO NAO FATAL,31/08/2023,2023,8,31,2023/08,07:50,AVENIDA DOUTOR MARCOS ANTÔNIO MACÁRIO DOS SANTOS,366.0,VIAS MUNICIPAIS,-21.19129651,-47.74006259,RIBEIRAO PRETO,Ribeirão Preto,,,1.0,,,,1.0,,2.0,,,,PREFEITURA,PREFEITURA,MUNICIPAL,COLISAO,,S,,,S,,,,,,,,0
463132,2104332,SINISTRO NAO FATAL,26/04/2024,2024,4,26,2024/04,12:15,AVENIDA CRUZEIRO DO SUL,17.0,VIAS MUNICIPAIS,-22.32342988,-49.05811622,BAURU,Bauru,,,,,,,2.0,1.0,1.0,,,,PREFEITURA,PREFEITURA,MUNICIPAL,COLISAO,,S,,S,,,,,,,,,0
635688,2578389,SINISTRO NAO FATAL,22/03/2025,2025,3,22,2025/03,19:09,RUA RICARDO TAGLIARI,1.0,VIAS MUNICIPAIS,-22.5562703,-47.1627428,ARTUR NOGUEIRA,Campinas,,,,,,,,,,,,,PREFEITURA,PREFEITURA,MUNICIPAL,CHOQUE,,,,,,,S,,,,,,0
392899,1268737,SINISTRO NAO FATAL,19/12/2023,2023,12,19,2023/12,15:16,AVENIDA JURITI,3103.0,VIAS MUNICIPAIS,-23.5999905,-46.6642658,SAO PAULO,Metropolitana de São Paulo,,,,3.0,,,,2.0,,,,,PREFEITURA,PREFEITURA,MUNICIPAL,OUTROS,,,,,,,,,,,S,,0
29525,1346706,SINISTRO NAO FATAL,05/03/2022,2022,3,5,2022/03,11:20,RUA CORONEL CLEMENTINO,109.0,VIAS MUNICIPAIS,-21.02288434,-47.75884911,JARDINOPOLIS,Ribeirão Preto,,,1.0,,,,2.0,2.0,1.0,,,,PREFEITURA,PREFEITURA,MUNICIPAL,COLISAO,,,,S,,,,,,,,,0
411027,1609055,NOTIFICACAO,22/01/2024,2024,1,22,2024/01,21:18,RUA MANOEL DIAS DO CAMPO,400.0,VIAS MUNICIPAIS,-23.4861004,-46.6714519,SAO PAULO,Metropolitana de São Paulo,,,,,,,,,,,,,PREFEITURA,PREFEITURA,MUNICIPAL,OUTROS,,,,,,,,,,,S,,0
166041,1891255,NOTIFICACAO,12/11/2022,2022,11,12,2022/11,02:52,MARGINAL MARGINAL TIETE CENTRAL SENTIDO GUARULHOS,100.0,VIAS MUNICIPAIS,-23.52344959,-46.7473625,SAO PAULO,Metropolitana de São Paulo,,,,,,,,,,,,,PREFEITURA,PREFEITURA,MUNICIPAL,OUTROS,,,,,,,,,,,S,,0
610137,2510286,NOTIFICACAO,27/01/2025,2025,1,27,2025/01,16:44,AVENIDA MARTINS JUNIOR,1216.0,VIAS MUNICIPAIS,-23.4280122,-46.5088509,GUARULHOS,Metropolitana de São Paulo,,,,,,,,,,,,,PREFEITURA,PREFEITURA,MUNICIPAL,OUTROS,,,,,,,,,,,S,,0
261457,1607188,SINISTRO NAO FATAL,14/05/2023,2023,5,14,2023/05,16:19,AVENIDA CARAMURU,732.0,VIAS MUNICIPAIS,-21.17942204,-47.8170069,RIBEIRAO PRETO,Ribeirão Preto,,,1.0,,,,1.0,2.0,,,,1.0,PREFEITURA,PREFEITURA,MUNICIPAL,CHOQUE,,,,,,,S,,,S,,,1
184925,1308415,SINISTRO NAO FATAL,17/12/2022,2022,12,17,2022/12,12:39,AVENIDA PADRE JOAO RODRIGUES CREPALDI,1436.0,VIAS MUNICIPAIS,-21.781615,-48.15812,ARARAQUARA,Central,,,1.0,,,,1.0,1.0,1.0,,,,PREFEITURA,PREFEITURA,MUNICIPAL,COLISAO,,,,S,,,,,,,,,0
367705,2124662,NOTIFICACAO,07/11/2023,2023,11,7,2023/11,10:18,BR 116,100.0,RODOVIAS,-23.459014,-46.482253,GUARULHOS,Metropolitana de São Paulo,,,,,,,,,,,,,CONCESSIONÁRIA,NOVADUTRA,FEDERAL,OUTROS,,,,,,,,,,,S,,0
477692,2336283,NOTIFICACAO,21/05/2024,2024,5,21,2024/05,07:37,AVENIDA VICENTE BRANDÃO FERREIRA,1.0,VIAS MUNICIPAIS,-23.235053,-45.830677,SAO JOSE DOS CAMPOS,São José dos Campos,,,,,,,,,,,,,PREFEITURA,PREFEITURA,MUNICIPAL,NAO DISPONIVEL,,,,,,,,,,,,S,0
544325,2405131,SINISTRO NAO FATAL,19/09/2024,2024,9,19,2024/09,12:09,AVENIDA MINISTRO RUI BARBOSA,1740.0,VIAS MUNICIPAIS,-20.5273537,-47.4375886,FRANCA,Franca,,,,2.0,,,,1.0,,,,,PREFEITURA,PREFEITURA,MUNICIPAL,OUTROS,,,,,,,,,,,S,S,0
458467,1385828,SINISTRO NAO FATAL,18/04/2024,2024,4,18,2024/04,17:53,SP 019,10.0,RODOVIAS,-23.46144,-46.4907212,GUARULHOS,Metropolitana de São Paulo,,,1.0,,,,1.0,1.0,1.0,,,,CONCESSIONÁRIA,ECOPISTAS,ESTADUAL,COLISAO,,,,S,,,,,,S,,,0
17526,1709844,SINISTRO NAO FATAL,11/02/2022,2022,2,11,2022/02,22:26,PELO PA DE GUAPIACU,1.0,VIAS MUNICIPAIS,-20.79866073,-49.22144712,GUAPIACU,São José do Rio Preto,,,,,,,1.0,1.0,,,,1.0,PREFEITURA,PREFEITURA,MUNICIPAL,ATROPELAMENTO,S,,,,,,,,,,,,1
625301,2553527,SINISTRO NAO FATAL,28/02/2025,2025,2,28,2025/02,06:06,AVENIDA INAJAR DE SOUZA,3371.0,VIAS MUNICIPAIS,-23.4803334,-46.6737249,SAO PAULO,Metropolitana de São Paulo,,,,,,,,,,,,,PREFEITURA,PREFEITURA,MUNICIPAL,ATROPELAMENTO,S,,,,,,,,,,,,0
468496,2325025,NOTIFICACAO,05/05/2024,2024,5,5,2024/05,19:46,AVENIDA ITATIBA,728.0,VIAS MUNICIPAIS,-23.172136,-46.8846691,JUNDIAI,Campinas,,,,,,,,,,,,,PREFEITURA,PREFEITURA,MUNICIPAL,NAO DISPONIVEL,,,,,,,,,,,,S,0
24122,2233083,NOTIFICACAO,23/02/2022,2022,2,23,2022/02,13:34,RUA REGENTE FEIJÓ,166.0,VIAS MUNICIPAIS,-23.67234078,-46.45049012,MAUA,Metropolitana de São Paulo,,,,,,,,,,,,,PREFEITURA,PREFEITURA,MUNICIPAL,OUTROS,,,,,,,,,,,S,,0
344047,1967086,SINISTRO NAO FATAL,28/09/2023,2023,9,28,2023/09,09:37,RUA ANTÔNIO RAMOS ROSA,758.0,VIAS MUNICIPAIS,-23.6614548,-46.7500784,SAO PAULO,Metropolitana de São Paulo,,,1.0,,,,1.0,2.0,1.0,,,,PREFEITURA,PREFEITURA,MUNICIPAL,COLISAO,,,,S,,,,,,,,,0
485251,2276476,SINISTRO NAO FATAL,04/06/2024,2024,6,4,2024/06,22:12,RUA RUBÉNS ARRUDA,7.0,VIAS MUNICIPAIS,-22.3258962,-49.07970414,BAURU,Bauru,,,,,,,1.0,,1.0,,,,PREFEITURA,PREFEITURA,MUNICIPAL,COLISAO,,S,,,,,,,,,,,0
478893,2313488,SINISTRO NAO FATAL,23/05/2024,2024,5,23,2024/05,06:50,SP 077,1.0,RODOVIAS,-23.2993567,-45.9496709,JACAREI,São José dos Campos,,,,,,,1.0,,1.0,,,,NAO DISPONIVEL,NAO DISPONIVEL,ESTADUAL,CHOQUE,,,,,,,S,,,,S,,0
630448,2567338,NOTIFICACAO,10/03/2025,2025,3,10,2025/03,20:52,SP 070,1.0,RODOVIAS,-23.52098728,-46.55562899,SAO PAULO,Metropolitana de São Paulo,,,,,,,,,,,,,CONCESSIONÁRIA,ECOPISTAS,ESTADUAL,NAO DISPONIVEL,,,,,,,,,,,,S,0
375290,2234272,SINISTRO NAO FATAL,19/11/2023,2023,11,19,2023/11,08:20,SP 127,42.0,RODOVIAS,-22.6844231,-47.63837394,PIRACICABA,Campinas,,,,,,,1.0,1.0,1.0,,,,NAO DISPONIVEL,NAO DISPONIVEL,ESTADUAL,COLISAO,,,S,,,,,,,,,,0
183760,1987535,NOTIFICACAO,15/12/2022,2022,12,15,2022/12,10:14,ROMEU MAIA SOLTO,341.0,VIAS MUNICIPAIS,-21.0594353104,-49.6850809801,JOSE BONIFACIO,São José do Rio Preto,,,,,,,,,,,,,PREFEITURA,PREFEITURA,MUNICIPAL,OUTROS,,,,,,,,,,,S,,0
422454,2162415,SINISTRO NAO FATAL,12/02/2024,2024,2,12,2024/02,00:30,AVENIDA PRESIDENTE JUSCELINO KUBITSCHEK,1.0,VIAS MUNICIPAIS,-235856.0,-466711.0,SAO PAULO,Metropolitana de São Paulo,,,,2.0,,,,1.0,,,,,PREFEITURA,PREFEITURA,MUNICIPAL,OUTROS,,,,,,,,,,,S,,0
402859,1481363,SINISTRO NAO FATAL,06/01/2024,2024,1,6,2024/01,15:56,AVENIDA SANTO ANTONIO,10.0,VIAS MUNICIPAIS,-22.17244597,-49.95292624,MARILIA,Marília,,,1.0,,,,1.0,1.0,2.0,,,,PREFEITURA,PREFEITURA,MUNICIPAL,COLISAO,,,,S,,,,,,,,,0
155104,1842708,SINISTRO NAO FATAL,23/10/2022,2022,10,23,2022/10,21:16,SP 300,252.0,RODOVIAS,-22.88041684,-48.46861377,BOTUCATU,Sorocaba,,,1.0,,,,,,2.0,,,,CONCESSIONÁRIA,RODOVIAS DO TIETÊ,ESTADUAL,OUTROS,,,,,,,,,,S,,,0
141352,2490773,SINISTRO FATAL,28/09/2022,2022,9,28,2022/09,09:45,AVENIDA DOUTOR MARCOS DE PAULA RAFAEL,15.0,VIAS MUNICIPAIS,-22.2942264051,-49.0461362865,BAURU,Bauru,,,,,,,1.0,,,1.0,,,PREFEITURA,PREFEITURA,MUNICIPAL,ATROPELAMENTO,S,,,,,,,,,,,S,1
338847,2114269,NOTIFICACAO,18/09/2023,2023,9,18,2023/09,11:08,RUA ERVA DE CARPINTEIRO,514.0,VIAS MUNICIPAIS,-23.51158428,-46.4455076,SAO PAULO,Metropolitana de São Paulo,,,,,,,,,,,,,PREFEITURA,PREFEITURA,MUNICIPAL,OUTROS,,,,,,,,,,,S,S,0
95091,2164838,SINISTRO NAO FATAL,04/07/2022,2022,7,4,2022/07,12:01,PRAÇA SAMUEL SABATINE,50.0,VIAS MUNICIPAIS,-23.69617901,-46.55060784,SAO BERNARDO DO CAMPO,Metropolitana de São Paulo,,1.0,,,,,1.0,1.0,2.0,,,,PREFEITURA,PREFEITURA,MUNICIPAL,COLISAO,,S,,,,,,,,,S,,0
160642,2080536,SINISTRO NAO FATAL,02/11/2022,2022,11,2,2022/11,11:07,AVENIDA FRANCISCO ERNESTO FÁVERO,5.0,VIAS MUNICIPAIS,-23.28436311,-47.29058978,ITU,Sorocaba,,,2.0,,,,1.0,2.0,2.0,,,,PREFEITURA,PREFEITURA,MUNICIPAL,COLISAO,,,,S,,,,,,,,,0
512502,2265050,SINISTRO NAO FATAL,23/07/2024,2024,7,23,2024/07,15:09,AVENIDA PEREIRA BARRETO,1379.0,VIAS MUNICIPAIS,-23.6863737,-46.5482371,SAO BERNARDO DO CAMPO,Metropolitana de São Paulo,,,1.0,1.0,,,2.0,3.0,2.0,,,,PREFEITURA,PREFEITURA,MUNICIPAL,ATROPELAMENTO,S,,,,,,,,,,S,,0
427278,1482544,NOTIFICACAO,22/02/2024,2024,2,22,2024/02,18:57,AVENIDA DOM PEDRO I,1.0,VIAS MUNICIPAIS,-23.0313164,-45.5481382,TAUBATE,São José dos Campos,,,,,,,,,,,,,PREFEITURA,PREFEITURA,MUNICIPAL,OUTROS,,,,,,,,,,,S,,0
46370,2320419,NOTIFICACAO,06/04/2022,2022,4,6,2022/04,00:30,RUA GUILHERME DE ALMEIDA,0.0,VIAS MUNICIPAIS,-22.33598961,-49.05487156,BAURU,Bauru,,,,,,,,,,,,,PREFEITURA,PREFEITURA,MUNICIPAL,OUTROS,,,,,,,,,,,S,S,0
216037,1728473,SINISTRO NAO FATAL,19/02/2023,2023,2,19,2023/02,19:59,RUA AUGUSTO DE ALMEIDA BATISTA,1431.0,VIAS MUNICIPAIS,-23.66557567,-46.81202285,EMBU DAS ARTES,Metropolitana de São Paulo,,,,1.0,1.0,,,2.0,,,,,PREFEITURA,PREFEITURA,MUNICIPAL,COLISAO,,,,S,,,,,,,S,,0
338310,2188269,SINISTRO NAO FATAL,17/09/2023,2023,9,17,2023/09,07:29,AVENIDA ROTARY,447.0,VIAS MUNICIPAIS,-23.72206299,-46.54650918,SAO BERNARDO DO CAMPO,Metropolitana de São Paulo,,,,,,,3.0,3.0,1.0,,,,PREFEITURA,PREFEITURA,MUNICIPAL,COLISAO,,,S,,,,,,S,,,,0
159032,1724635,SINISTRO NAO FATAL,30/10/2022,2022,10,30,2022/10,01:01,AVENIDA PRESIDENTE JUSCELINO KUBITSCHEK,523.0,VIAS MUNICIPAIS,-23.1843529,-45.86015545,SAO JOSE DOS CAMPOS,São José dos Campos,,,,,,,1.0,1.0,1.0,,,1.0,PREFEITURA,PREFEITURA,MUNICIPAL,CHOQUE,,,,,,,S,,,,S,,1
199052,1407590,SINISTRO NAO FATAL,16/01/2023,2023,1,16,2023/01,17:03,RUA LOPES TROVÃO,180.0,VIAS MUNICIPAIS,-22.98458257,-49.8689931,OURINHOS,Marília,1.0,,,,,,1.0,1.0,1.0,,,,PREFEITURA,PREFEITURA,MUNICIPAL,ATROPELAMENTO,S,,,,,,,,,,,,0
324162,1710870,NOTIFICACAO,24/08/2023,2023,8,24,2023/08,19:16,AVENIDA PRESIDENTE CASTELO BRANCO,100.0,VIAS MUNICIPAIS,-23.5254005,-46.60105486,SAO PAULO,Metropolitana de São Paulo,,,,,,,,,,,,,PREFEITURA,PREFEITURA,MUNICIPAL,OUTROS,,,,,,,,,,,S,,0
44506,2486907,SINISTRO FATAL,03/04/2022,2022,4,3,2022/04,01:05,AVENIDA PIRACEMA,48.0,VIAS MUNICIPAIS,-23.5107057318,-46.8331152153,BARUERI,Metropolitana de São Paulo,,,,,,,1.0,1.0,,1.0,,,PREFEITURA,PREFEITURA,MUNICIPAL,ATROPELAMENTO,S,,,,,,,,,,,S,1
196812,1952139,SINISTRO NAO FATAL,12/01/2023,2023,1,12,2023/01,07:50,RUA RONALDO DE SOUZA GAY,360.0,VIAS MUNICIPAIS,-22.82091977,-45.18888364,GUARATINGUETA,São José dos Campos,,,,,,,1.0,1.0,1.0,,,,PREFEITURA,PREFEITURA,MUNICIPAL,ATROPELAMENTO,S,,,,,,,,,,S,,0
65460,1276000,SINISTRO NAO FATAL,12/05/2022,2022,5,12,2022/05,16:13,AVENIDA DAS NACOES UNIDAS,22540.0,VIAS MUNICIPAIS,-23.6781039,-46.697605,SAO PAULO,Metropolitana de São Paulo,,,3.0,1.0,,,,2.0,1.0,,,,PREFEITURA,PREFEITURA,MUNICIPAL,COLISAO,,,S,,,,,,,,S,,0
423755,1876157,SINISTRO NAO FATAL,15/02/2024,2024,2,15,2024/02,06:30,SP 255,74.0,RODOVIAS,-21.80535,-48.1502043,ARARAQUARA,Central,,,,,,,1.0,,1.0,,,,CONCESSIONÁRIA,VIAPAULISTA,ESTADUAL,OUTROS,,,,,,,,S,,,,,0
453938,1962338,SINISTRO NAO FATAL,09/04/2024,2024,4,9,2024/04,00:54,AVENIDA DOS AUTONOMISTAS,100.0,VIAS MUNICIPAIS,-23.5311966,-46.7857262,OSASCO,Metropolitana de São Paulo,,,,1.0,,,,1.0,,,,,PREFEITURA,PREFEITURA,MUNICIPAL,ATROPELAMENTO,S,,,,,,,,,,S,,0
154827,1730557,SINISTRO NAO FATAL,23/10/2022,2022,10,23,2022/10,18:27,AVENIDA PEDRO DE TOLEDO,0.0,VIAS MUNICIPAIS,-21.54274776,-49.85355735,PROMISSAO,Bauru,,,1.0,,,,1.0,1.0,1.0,,,,PREFEITURA,PREFEITURA,MUNICIPAL,COLISAO,,,,S,,,,,,,,,0
181531,1538218,NOTIFICACAO,11/12/2022,2022,12,11,2022/12,14:51,AVENIDA JACÚ PESSEGO,5700.0,VIAS MUNICIPAIS,-23.5297598543,-46.4571649522,SAO PAULO,Metropolitana de São Paulo,,,,,,,,,,,,,PREFEITURA,PREFEITURA,MUNICIPAL,OUTROS,,,,,,,,,,,S,,0
29240,1551491,SINISTRO NAO FATAL,05/03/2022,2022,3,5,2022/03,14:42,ESTRADA DO PONEY CLUB  ALVARENGA ESTRADA DO PONE,101.0,VIAS MUNICIPAIS,-23.75085219,-46.60647504,SAO BERNARDO DO CAMPO,Metropolitana de São Paulo,,,1.0,,,,,1.0,,,,1.0,PREFEITURA,PREFEITURA,MUNICIPAL,ATROPELAMENTO,S,,,,,,,,,,,,1
335826,2228582,SINISTRO NAO FATAL,13/09/2023,2023,9,13,2023/09,12:32,AVENIDA MARIA ANTONIA CAMARGO DE OLIVEIRA,3821.0,VIAS MUNICIPAIS,-21.80257794,-48.17317233,ARARAQUARA,Central,,1.0,1.0,,,,,1.0,1.0,,,,PREFEITURA,PREFEITURA,MUNICIPAL,COLISAO,,,,S,,,,,,,,,0
151745,1460299,SINISTRO NAO FATAL,17/10/2022,2022,10,17,2022/10,18:17,ACESSO AVENIDA AIRTON SENNA DA SILVA,1.0,VIAS MUNICIPAIS,-23.97263971,-46.36948846,SAO VICENTE,Baixada Santista,,,1.0,,,,,1.0,1.0,,,,PREFEITURA,PREFEITURA,MUNICIPAL,COLISAO,,S,,S,,,,,,,,,0
105688,2222470,SINISTRO NAO FATAL,24/07/2022,2022,7,24,2022/07,05:50,AVENIDA INDEPENDÊNCIA,3500.0,VIAS MUNICIPAIS,-23.45050785,-47.41817255,SOROCABA,Sorocaba,,,,,,,1.0,1.0,,,,,PREFEITURA,PREFEITURA,MUNICIPAL,CHOQUE,,,,,,,S,S,,,,,0
575650,2422027,SINISTRO NAO FATAL,16/11/2024,2024,11,16,2024/11,16:01,PRAÇA GOLDA MEIR,145.0,VIAS MUNICIPAIS,-23.5395069,-46.6648607,SAO PAULO,Metropolitana de São Paulo,,,1.0,,,,1.0,1.0,1.0,,,,PREFEITURA,PREFEITURA,MUNICIPAL,COLISAO,,S,,,,,,,,,,,0
393260,2049175,NOTIFICACAO,19/12/2023,2023,12,19,2023/12,10:06,ESTRADA MARCO POLO,212.0,VIAS MUNICIPAIS,-23.7569998,-46.5749898,SAO BERNARDO DO CAMPO,Metropolitana de São Paulo,,,,,,,,,,,,,PREFEITURA,PREFEITURA,MUNICIPAL,NAO DISPONIVEL,,,,,,,,,,,,S,0
432839,1807408,NOTIFICACAO,02/03/2024,2024,3,2,2024/03,20:43,RUA LAURINDO SOLDERA,142.0,VIAS MUNICIPAIS,-23.0836884,-46.9846504,LOUVEIRA,Campinas,,,,,,,,,,,,,PREFEITURA,PREFEITURA,MUNICIPAL,NAO DISPONIVEL,,,,,,,,,,,,S,0
504650,2345115,NOTIFICACAO,07/07/2024,2024,7,7,2024/07,04:23,SP 070,130.0,RODOVIAS,-23.1047052,-45.635237,CACAPAVA,São José dos Campos,,,,,,,,,,,,,CONCESSIONÁRIA,ECOPISTAS,ESTADUAL,ATROPELAMENTO,S,,,,,,,,,,,,0
613369,2554067,SINISTRO NAO FATAL,04/02/2025,2025,2,4,2025/02,07:30,AVENIDA NACOES UNIDAS,582.0,VIAS MUNICIPAIS,-23.9675757,-46.4031332,SAO VICENTE,Baixada Santista,,,1.0,,,,,,2.0,,,,PREFEITURA,PREFEITURA,MUNICIPAL,COLISAO,,S,,,,,,,,,,,0
262186,2108480,SINISTRO NAO FATAL,15/05/2023,2023,5,15,2023/05,10:10,RUA SANTA CECÍLIA,0.0,VIAS MUNICIPAIS,-22.65644935,-50.41946468,ASSIS,Marília,,1.0,,,,,1.0,1.0,1.0,,,,PREFEITURA,PREFEITURA,MUNICIPAL,COLISAO,,,,S,,,,,,,,,0
601596,2508316,SINISTRO NAO FATAL,08/01/2025,2025,1,8,2025/01,15:16,RUA CAPITAO SALOMAO,173.0,VIAS MUNICIPAIS,-21.1611261,-47.8125283,RIBEIRAO PRETO,Ribeirão Preto,,,1.0,,,,1.0,1.0,1.0,,,,PREFEITURA,PREFEITURA,MUNICIPAL,COLISAO,,,,S,,,,,,,,,0
47393,1931020,SINISTRO NAO FATAL,08/04/2022,2022,4,8,2022/04,07:14,ESTRADA ROMAO DIAS GOES,100.0,VIAS MUNICIPAIS,-23.52124477,-47.12921345,SAO ROQUE,Sorocaba,,,,,,,1.0,,1.0,,,,PREFEITURA,PREFEITURA,MUNICIPAL,COLISAO,,S,,,,,,,,,S,,0
6656,1287922,NOTIFICACAO,18/01/2022,2022,1,18,2022/01,14:53,RUA INACIO PEREIRA DA ROCHA,54.0,VIAS MUNICIPAIS,-23.55890285,-46.68763591,SAO PAULO,Metropolitana de São Paulo,,,,,,,,,,,,,PREFEITURA,PREFEITURA,MUNICIPAL,OUTROS,,,,,,,,,,,S,,0
671248,2608800,SINISTRO NAO FATAL,29/05/2025,2025,5,29,2025/05,11:37,RUA GENERAL OSORIO,1.0,VIAS MUNICIPAIS,-20.9952067,-47.6558493,BRODOWSKI,Ribeirão Preto,,,1.0,,,,1.0,1.0,1.0,,,,PREFEITURA,PREFEITURA,MUNICIPAL,COLISAO,,S,,S,,,,,,,,,0
293355,1802382,NOTIFICACAO,04/07/2023,2023,7,4,2023/07,07:00,AVENIDA CESAR DEBOLUCCI,1271.0,VIAS MUNICIPAIS,-21.20794139,-47.85209084,RIBEIRAO PRETO,Ribeirão Preto,,,,,,,,,,,,,PREFEITURA,PREFEITURA,MUNICIPAL,OUTROS,,,,,,,,,,,S,,0
117254,1835762,SINISTRO NAO FATAL,14/08/2022,2022,8,14,2022/08,23:20,RUA MONSENHOR SOARES,637.0,VIAS MUNICIPAIS,-23.59079401,-48.05035248,ITAPETININGA,Sorocaba,,,1.0,,,,1.0,1.0,1.0,,,,PREFEITURA,PREFEITURA,MUNICIPAL,COLISAO,,,,S,,,,,,,,,0
419493,2227141,NOTIFICACAO,07/02/2024,2024,2,7,2024/02,13:13,AVENIDA BRÁS DA ROCHA CARDOSO,110.0,VIAS MUNICIPAIS,-23.4926891,-46.402035,SAO PAULO,Metropolitana de São Paulo,,,,,,,,,,,,,PREFEITURA,PREFEITURA,MUNICIPAL,NAO DISPONIVEL,,,,,,,,,,,,S,0
474889,2371872,SINISTRO NAO FATAL,16/05/2024,2024,5,16,2024/05,16:07,LADEIRA SÃO JOSÉ,1.0,VIAS MUNICIPAIS,-23.1021879,-45.7084705,CACAPAVA,São José dos Campos,,,1.0,,,,1.0,1.0,1.0,,,,PREFEITURA,PREFEITURA,MUNICIPAL,COLISAO,,S,,,,,,,,,,,0
587474,2447518,SINISTRO NAO FATAL,08/12/2024,2024,12,8,2024/12,00:00,BR 116,546.0,RODOVIAS,-24.9475070233,-48.424379313,BARRA DO TURVO,Registro,,,,,,,1.0,,1.0,,,,CONCESSIONÁRIA,AUTOPISTA REGIS BITTENCOURT,FEDERAL,OUTROS,,,,,,,,,,,S,,0
62149,1450682,SINISTRO NAO FATAL,06/05/2022,2022,5,6,2022/05,19:06,RUA GUILHERME BARBOSA DE MELO,54.0,VIAS MUNICIPAIS,-23.60490325,-46.69524353,SAO PAULO,Metropolitana de São Paulo,,,2.0,,,,1.0,2.0,1.0,,,,PREFEITURA,PREFEITURA,MUNICIPAL,COLISAO,,,,S,,,,,,,,,0
106868,1527435,NOTIFICACAO,27/07/2022,2022,7,27,2022/07,18:05,AVENIDA PADRE VICENTE MELILO,381.0,VIAS MUNICIPAIS,-23.54998789,-46.77537766,OSASCO,Metropolitana de São Paulo,,,,,,,,,,,,,PREFEITURA,PREFEITURA,MUNICIPAL,OUTROS,,,,,,,,,,,S,,0
167041,1993597,SINISTRO NAO FATAL,14/11/2022,2022,11,14,2022/11,00:00,BR 116,219.0,RODOVIAS,-23.447449869,-46.4551452929,GUARULHOS,Metropolitana de São Paulo,,,1.0,,,,,,1.0,,,,CONCESSIONÁRIA,NOVADUTRA,FEDERAL,OUTROS,,,,,,,,,,,S,,0
153478,1332010,SINISTRO NAO FATAL,20/10/2022,2022,10,20,2022/10,14:41,RUA PONTA PORÃ,0.0,VIAS MUNICIPAIS,-20.41377632,-49.97751041,VOTUPORANGA,São José do Rio Preto,,,1.0,,,,1.0,1.0,2.0,,,,PREFEITURA,PREFEITURA,MUNICIPAL,NAO DISPONIVEL,,,,,,,,,,,,S,0
240097,1550872,SINISTRO NAO FATAL,06/04/2023,2023,4,6,2023/04,18:34,RUA OTAVIO ALVES DUNDAS,212.0,VIAS MUNICIPAIS,-23.60026699,-46.53462243,SAO PAULO,Metropolitana de São Paulo,,,,1.0,,,,1.0,,,,,PREFEITURA,PREFEITURA,MUNICIPAL,OUTROS,,,,,,,,,,,S,,0
222084,2195246,NOTIFICACAO,03/03/2023,2023,3,3,2023/03,12:27,AVENIDA DONA BELMIRA MARIN,1121.0,VIAS MUNICIPAIS,-23.73966801,-46.69153672,SAO PAULO,Metropolitana de São Paulo,,,,,,,,,,,,,PREFEITURA,PREFEITURA,MUNICIPAL,OUTROS,,,,,,,,,,,S,,0
621358,2555985,SINISTRO NAO FATAL,20/02/2025,2025,2,20,2025/02,10:00,SP 088,47.0,RODOVIAS,-23.49952969,-46.22563683,MOGI DAS CRUZES,Metropolitana de São Paulo,,,,,,,,,,,,,NAO DISPONIVEL,NAO DISPONIVEL,ESTADUAL,OUTROS,,,,,,,,,,S,,,0
658074,2610081,SINISTRO NAO FATAL,05/05/2025,2025,5,5,2025/05,13:26,RUA TENRI,420.0,VIAS MUNICIPAIS,-24.7059631,-48.0058311,JACUPIRANGA,Registro,,,1.0,,,,1.0,1.0,,,,1.0,PREFEITURA,PREFEITURA,MUNICIPAL,COLISAO,,S,,,,,,,,,,,1
359264,1683136,NOTIFICACAO,23/10/2023,2023,10,23,2023/10,23:00,RUA PAES LEME,105.0,VIAS MUNICIPAIS,-23.5237408,-47.1332383,SAO ROQUE,Sorocaba,,,,,,,,,,,,,PREFEITURA,PREFEITURA,MUNICIPAL,OUTROS,,,,,,,,,,,S,,0
261189,1675409,NOTIFICACAO,13/05/2023,2023,5,13,2023/05,19:25,ACESSO MARGINAL ANHANGUERA,1592.0,VIAS MUNICIPAIS,-23.1890087,-46.90614712,JUNDIAI,Campinas,,,,,,,,,,,,,PREFEITURA,PREFEITURA,MUNICIPAL,OUTROS,,,,,,,,,,,S,,0
184451,1921361,NOTIFICACAO,16/12/2022,2022,12,16,2022/12,06:46,AVENIDA IMIRIM,2200.0,VIAS MUNICIPAIS,-23.4883485452,-46.6517647442,SAO PAULO,Metropolitana de São Paulo,,,,,,,,,,,,,PREFEITURA,PREFEITURA,MUNICIPAL,OUTROS,,,,,,,,,,,S,,0
474761,2359526,SINISTRO NAO FATAL,16/05/2024,2024,5,16,2024/05,13:00,SP 070,28.0,RODOVIAS,-23.46791684,-46.41514834,GUARULHOS,Metropolitana de São Paulo,,,1.0,,,,,,1.0,,,,CONCESSIONÁRIA,ECOPISTAS,ESTADUAL,OUTROS,,,,,,,,,,S,,,0
254945,2156281,NOTIFICACAO,03/05/2023,2023,5,3,2023/05,12:23,PRAÇA YONEKO HIGA,160.0,VIAS MUNICIPAIS,-23.57446744,-46.57740206,SAO PAULO,Metropolitana de São Paulo,,,,,,,,,,,,,PREFEITURA,PREFEITURA,MUNICIPAL,OUTROS,,,,,,,,,,,S,,0
43784,1452964,SINISTRO NAO FATAL,01/04/2022,2022,4,1,2022/04,20:07,ACESSO RUA GEOVANE BATISTA PIRELI,871.0,VIAS MUNICIPAIS,-23.6644525,-46.48954605,SANTO ANDRE,Metropolitana de São Paulo,,,,,,,2.0,1.0,1.0,,,,PREFEITURA,PREFEITURA,MUNICIPAL,COLISAO,,,S,,,,,,,,,,0
618809,2550318,SINISTRO NAO FATAL,15/02/2025,2025,2,15,2025/02,15:20,ENGENHEIRO CONSTANCIO CINTRA,118.0,VIAS MUNICIPAIS,-22.606233,-46.7061945,SERRA NEGRA,Campinas,,,1.0,,,,,,,,,1.0,PREFEITURA,PREFEITURA,MUNICIPAL,CHOQUE,,,,,,,S,,,S,,,1
665168,2595930,NOTIFICACAO,19/05/2025,2025,5,19,2025/05,14:21,RUA SANTA CRUZ,100.0,VIAS MUNICIPAIS,-23.0274857,-46.9792734,VINHEDO,Campinas,,,,,,,,,,,,,PREFEITURA,PREFEITURA,MUNICIPAL,COLISAO,,S,S,,,,,,,,,,0
98130,1640979,SINISTRO NAO FATAL,10/07/2022,2022,7,10,2022/07,13:50,AVENIDA ARICANDUVA,1100.0,VIAS MUNICIPAIS,-23.54653873,-46.52792763,SAO PAULO,Metropolitana de São Paulo,,,1.0,,,,1.0,1.0,1.0,,,,PREFEITURA,PREFEITURA,MUNICIPAL,COLISAO,,S,,,,,,,,,,,0
307346,2216854,SINISTRO NAO FATAL,27/07/2023,2023,7,27,2023/07,14:10,AVENIDA MATEO BEI,2268.0,VIAS MUNICIPAIS,-23.60229053,-46.48278573,SAO PAULO,Metropolitana de São Paulo,,,1.0,,,,1.0,1.0,1.0,,,,PREFEITURA,PREFEITURA,MUNICIPAL,COLISAO,,,,S,,,,,,,S,,0
129099,1442521,NOTIFICACAO,05/09/2022,2022,9,5,2022/09,01:32,RUA MINISTRO LINS DE BARROS,369.0,VIAS MUNICIPAIS,-23.4579114,-46.66758235,SAO PAULO,Metropolitana de São Paulo,,,,,,,,,,,,,PREFEITURA,PREFEITURA,MUNICIPAL,OUTROS,,,,,,,,,,,S,,0
57894,2011185,SINISTRO NAO FATAL,28/04/2022,2022,4,28,2022/04,10:20,RUA PARAGUAI,24.0,VIAS MUNICIPAIS,-22.93208068,-47.06690623,CAMPINAS,Campinas,,,,1.0,,,,1.0,,,,,PREFEITURA,PREFEITURA,MUNICIPAL,OUTROS,,,,,,,,,,,S,,0
144013,1704745,NOTIFICACAO,02/10/2022,2022,10,2,2022/10,16:24,SP 294,0.0,RODOVIAS,-21.9463985,-50.51992984,TUPA,Marília,,,,,,,,,,,,,CONCESSIONÁRIA,EIXOSP - PIPA,ESTADUAL,OUTROS,,,,,,,,,,,S,S,0
31132,1981984,SINISTRO NAO FATAL,08/03/2022,2022,3,8,2022/03,10:03,PRAÇA PATRIARCA JOSÉ BONIFÁCIO,1.0,VIAS MUNICIPAIS,-23.93732762,-46.32547975,SANTOS,Baixada Santista,1.0,,,,,,1.0,2.0,,,,,PREFEITURA,PREFEITURA,MUNICIPAL,COLISAO,,,,S,,,,,,,,,0
467474,2278855,NOTIFICACAO,03/05/2024,2024,5,3,2024/05,02:14,BR 116,1.0,RODOVIAS,-22.8754481,-45.2647598,ROSEIRA,São José dos Campos,,,,,,,,,,,,,CONCESSIONÁRIA,NOVADUTRA,FEDERAL,NAO DISPONIVEL,,,,,,,,,,,,S,0
378390,2187215,NOTIFICACAO,25/11/2023,2023,11,25,2023/11,10:43,RUA JACEGUAVA,100.0,VIAS MUNICIPAIS,-23.7565574,-46.7875009,ITAPECERICA DA SERRA,Metropolitana de São Paulo,,,,,,,,,,,,,PREFEITURA,PREFEITURA,MUNICIPAL,OUTROS,,,,,,,,,,,S,,0
665830,2600144,SINISTRO NAO FATAL,20/05/2025,2025,5,20,2025/05,19:59,RUA VOLUNTARIO CICERO LAMARTINE DA SILVA LEME,1.0,VIAS MUNICIPAIS,-22.9344384,-46.5334858,BRAGANCA PAULISTA,Campinas,,,,,,,3.0,3.0,2.0,,,,PREFEITURA,PREFEITURA,MUNICIPAL,COLISAO,,,S,,,,,,,,,,0
635938,2567768,NOTIFICACAO,23/03/2025,2025,3,23,2025/03,17:38,RUA HARRY DANNENBERG,385.0,VIAS MUNICIPAIS,-23.5538286,-46.4635641,SAO PAULO,Metropolitana de São Paulo,,,,,,,,,,,,,PREFEITURA,PREFEITURA,MUNICIPAL,OUTROS,,,,,,,,,,,S,,0
47651,1708146,SINISTRO NAO FATAL,08/04/2022,2022,4,8,2022/04,22:42,AVENIDA MANOEL DOS SANTOS BRAGA,810.0,VIAS MUNICIPAIS,-23.50631234,-46.47002081,SAO PAULO,Metropolitana de São Paulo,,,,,,,2.0,3.0,2.0,,,2.0,PREFEITURA,PREFEITURA,MUNICIPAL,COLISAO,,S,,,,,,,,,S,,1
461106,1981075,SINISTRO NAO FATAL,22/04/2024,2024,4,22,2024/04,08:39,RUA ALBERTO MUNIZ DA SILVA,173.0,VIAS MUNICIPAIS,-22.8881305,-47.1781354,HORTOLANDIA,Campinas,,,1.0,,,,1.0,1.0,1.0,,,,PREFEITURA,PREFEITURA,MUNICIPAL,COLISAO,,,,S,,,,,,,,,0
309829,1376227,NOTIFICACAO,31/07/2023,2023,7,31,2023/07,15:26,SP 079,100.0,RODOVIAS,-23.53852651,-47.45100499,VOTORANTIM,Sorocaba,,,,,,,,,,,,,DER,NAO DISPONIVEL,ESTADUAL,OUTROS,,,,,,,,,,,S,,0
637829,2566560,SINISTRO NAO FATAL,27/03/2025,2025,3,27,2025/03,21:05,AVENIDA WASHINGTON LUIS,2579.0,VIAS MUNICIPAIS,-22.12336166,-51.38233778,PRESIDENTE PRUDENTE,Presidente Prudente,,,,,,,,,,,,,PREFEITURA,PREFEITURA,MUNICIPAL,COLISAO,,,,S,,,,,,,,,0
116031,2192058,SINISTRO NAO FATAL,12/08/2022,2022,8,12,2022/08,14:01,RUA JOSE RICARDO ELIZETE,85.0,VIAS MUNICIPAIS,-22.40786782,-50.57270186,PARAGUACU PAULISTA,Marília,1.0,,,,1.0,,,1.0,1.0,,,,PREFEITURA,PREFEITURA,MUNICIPAL,COLISAO,,S,,,,,,,,,S,,0
70370,2294095,NOTIFICACAO,21/05/2022,2022,5,21,2022/05,19:20,AVENIDA 12,2130.0,VIAS MUNICIPAIS,-22.40722617,-47.57937943,RIO CLARO,Campinas,,,,,,,,,,,,,PREFEITURA,PREFEITURA,MUNICIPAL,OUTROS,,,,,,,,,,,S,,0
603521,2509488,SINISTRO NAO FATAL,12/01/2025,2025,1,12,2025/01,10:50,SP 349,1.0,RODOVIAS,-22.07970773,-49.71922464,ALVARO DE CARVALHO,Marília,,,1.0,,,,,,,,,1.0,DER,07.03,ESTADUAL,OUTROS,,,,,,,,,,S,,,1
33948,2044813,SINISTRO NAO FATAL,13/03/2022,2022,3,13,2022/03,03:20,RUA SÃO PEDRO,2570.0,VIAS MUNICIPAIS,-24.1116141,-49.32247501,ITARARE,Itapeva,,,,,,,1.0,2.0,1.0,,,,PREFEITURA,PREFEITURA,MUNICIPAL,COLISAO,,S,,,,,,,,,,,0
124085,1712967,SINISTRO NAO FATAL,27/08/2022,2022,8,27,2022/08,18:49,AVENIDA FRANCISCO MARENGO,1686.0,VIAS MUNICIPAIS,-23.50618624,-46.29992986,SUZANO,Metropolitana de São Paulo,,,1.0,,,,1.0,1.0,1.0,,,,PREFEITURA,PREFEITURA,MUNICIPAL,COLISAO,,,,S,,,,,,,,,0
534368,2399009,NOTIFICACAO,01/09/2024,2024,9,1,2024/09,18:16,RUA PROFESSOR PAULO MANGABEIRA ALBERNAZ,150.0,VIAS MUNICIPAIS,-23.6676775,-46.6562686,SAO PAULO,Metropolitana de São Paulo,,,,,,,,,,,,,PREFEITURA,PREFEITURA,MUNICIPAL,OUTROS,,,,,,,,,,,S,,0
519768,2390220,SINISTRO NAO FATAL,05/08/2024,2024,8,5,2024/08,13:30,RUA CONSELHEIRO RIBAS,1.0,VIAS MUNICIPAIS,-23.9754744,-46.3135514,SANTOS,Baixada Santista,,,,,,,1.0,1.0,1.0,,,,PREFEITURA,PREFEITURA,MUNICIPAL,ATROPELAMENTO,S,,,,,,,,,,,,0
471283,2352130,SINISTRO NAO FATAL,10/05/2024,2024,5,10,2024/05,15:29,RUA SANDANHA MARINHO,1.0,VIAS MUNICIPAIS,-22.88769025,-49.62092992,SANTA CRUZ DO RIO PARDO,Marília,,,2.0,,,,,,2.0,,,,PREFEITURA,PREFEITURA,MUNICIPAL,COLISAO,,,,S,,,,,,,S,,0
619597,2555118,NOTIFICACAO,16/02/2025,2025,2,16,2025/02,01:57,AVENIDA DEPUTADO VIRGILIO DE CARVALHO PINTO,100.0,VIAS MUNICIPAIS,-22.9137244,-46.5526251,BRAGANCA PAULISTA,Campinas,,,,,,,,,,,,,PREFEITURA,PREFEITURA,MUNICIPAL,OUTROS,,,,,,,,,,,S,,0
363298,1857785,NOTIFICACAO,30/10/2023,2023,10,30,2023/10,07:05,ALAMEDA ARAGUAIA,100.0,VIAS MUNICIPAIS,-23.5002125,-46.8599069,BARUERI,Metropolitana de São Paulo,,,,,,,,,,,,,PREFEITURA,PREFEITURA,MUNICIPAL,OUTROS,,,,,,,,,,,S,S,0
286764,1409819,NOTIFICACAO,23/06/2023,2023,6,23,2023/06,16:07,RUA GRAVATAÍ,1282.0,VIAS MUNICIPAIS,-22.97894966,-47.14908625,CAMPINAS,Campinas,,,,,,,,,,,,,PREFEITURA,PREFEITURA,MUNICIPAL,OUTROS,,,,,,,,,,,S,,0
344281,1980501,SINISTRO NAO FATAL,28/09/2023,2023,9,28,2023/09,09:18,RUA MORUBIXABA,259.0,VIAS MUNICIPAIS,-23.5615515,-46.4800253,SAO PAULO,Metropolitana de São Paulo,,,,1.0,,,,1.0,,,,,PREFEITURA,PREFEITURA,MUNICIPAL,OUTROS,,,,,,,,,,,S,,0
367443,2507245,SINISTRO FATAL,07/11/2023,2023,11,7,2023/11,11:30,RUA BENJAMIN CONSTANT,1.0,VIAS MUNICIPAIS,-22.9046455727,-49.6289160591,SANTA CRUZ DO RIO PARDO,Marília,,,1.0,,,,,1.0,,1.0,,,PREFEITURA,PREFEITURA,MUNICIPAL,ATROPELAMENTO,S,,,,,,,,,,,S,1
472294,2500566,SINISTRO FATAL,12/05/2024,2024,5,12,2024/05,19:10,SP 340,271.5,RODOVIAS,-21.5020907274,-47.0175607861,MOCOCA,Campinas,,,,,,,1.0,,,1.0,,,CONCESSIONÁRIA,RENOVIAS,ESTADUAL,CHOQUE,,,,,,,S,S,,,,,1
226557,1697391,NOTIFICACAO,11/03/2023,2023,3,11,2023/03,20:52,ACESSO CANDIDO PORTINARI,373.0,VIAS MUNICIPAIS,-20.56140338,-47.4127201,FRANCA,Franca,,,,,,,,,,,,,PREFEITURA,PREFEITURA,MUNICIPAL,OUTROS,,,,,,,,,,,S,,0
503518,2458949,SINISTRO FATAL,06/07/2024,2024,7,6,2024/07,18:27,SP 310,276.0,RODOVIAS,-21.7889493266,-48.2178751127,ARARAQUARA,Central,,1.0,1.0,,,,1.0,1.0,,1.0,,,CONCESSIONÁRIA,ECONOROESTE,ESTADUAL,ATROPELAMENTO,S,,,,,,,,,,S,,1
171565,2049878,SINISTRO NAO FATAL,23/11/2022,2022,11,23,2022/11,12:14,RUA PADRE ANTÔNIO VIÊIRA,485.0,VIAS MUNICIPAIS,-22.7445171308,-47.3477945944,AMERICANA,Campinas,,,,3.0,,,,1.0,,,,,PREFEITURA,PREFEITURA,MUNICIPAL,OUTROS,,,,,,,,,,,S,,0
660679,2607149,NOTIFICACAO,10/05/2025,2025,5,10,2025/05,05:03,AVENIDA ARQUITETO VILANOVA ARTIGAS,2144.0,VIAS MUNICIPAIS,-23.5979176,-46.4984289,SAO PAULO,Metropolitana de São Paulo,,,,,,,,,,,,,PREFEITURA,PREFEITURA,MUNICIPAL,NAO DISPONIVEL,,,,,,,,,,,,S,0
202072,2134006,NOTIFICACAO,22/01/2023,2023,1,22,2023/01,05:17,AV PROFESSOR HERMONEGES DE FREITAS LEITAO FILHO,1200.0,VIAS MUNICIPAIS,-23.80122928,-46.71137658,SAO PAULO,Metropolitana de São Paulo,,,,,,,,,,,,,PREFEITURA,PREFEITURA,MUNICIPAL,OUTROS,,,,,,,,,,,S,,0
353311,1606985,SINISTRO NAO FATAL,13/10/2023,2023,10,13,2023/10,23:09,AVENIDA PRIMAVERA DE CAIENA,177.0,VIAS MUNICIPAIS,-23.6132491,-46.5110244,SAO PAULO,Metropolitana de São Paulo,,,,1.0,,,,,,,,1.0,PREFEITURA,PREFEITURA,MUNICIPAL,ATROPELAMENTO,S,,,,,,,,,,,,1
622177,2553088,NOTIFICACAO,22/02/2025,2025,2,22,2025/02,22:22,RUA ELIAS ANTONIO ZOGBI,150.0,VIAS MUNICIPAIS,-23.6610323,-46.7071462,SAO PAULO,Metropolitana de São Paulo,,,,,,,,,,,,,PREFEITURA,PREFEITURA,MUNICIPAL,OUTROS,,,,,,,,,,,S,,0
380473,1748700,SINISTRO NAO FATAL,29/11/2023,2023,11,29,2023/11,06:57,ESTRADA DE PIRAPORA,100.0,VIAS MUNICIPAIS,-23.4268561,-46.799286,SAO PAULO,Metropolitana de São Paulo,,,1.0,,,,1.0,1.0,2.0,,,,PREFEITURA,PREFEITURA,MUNICIPAL,OUTROS,,,,,,,,,,,S,,0
658231,2595607,NOTIFICACAO,06/05/2025,2025,5,6,2025/05,15:19,RUA MATUTINA,56.0,VIAS MUNICIPAIS,-23.4978443,-46.5552008,GUARULHOS,Metropolitana de São Paulo,,,,,,,,,,,,,PREFEITURA,PREFEITURA,MUNICIPAL,NAO DISPONIVEL,,,,,,,,,,,,S,0
183221,1916408,SINISTRO NAO FATAL,14/12/2022,2022,12,14,2022/12,09:33,AVENIDA VALDOMIRO LOPES DA SILVA,173.0,VIAS MUNICIPAIS,-20.7668422278,-49.3765280927,SAO JOSE DO RIO PRETO,São José do Rio Preto,,1.0,1.0,,,,,1.0,1.0,,,,PREFEITURA,PREFEITURA,MUNICIPAL,COLISAO,,,,S,,,,,,,,,0
204387,1296519,NOTIFICACAO,27/01/2023,2023,1,27,2023/01,01:13,SPITAL SAO FRANCISCO  UNIDADE NETTO CAMPELLO,1.0,VIAS MUNICIPAIS,-21.136652,-47.9881821,SERTAOZINHO,Ribeirão Preto,,,,,,,,,,,,,PREFEITURA,PREFEITURA,MUNICIPAL,NAO DISPONIVEL,,,,,,,,,,,,S,0
570755,2453557,SINISTRO NAO FATAL,06/11/2024,2024,11,6,2024/11,12:06,AVENIDA MIGUEL YUNES,735.0,VIAS MUNICIPAIS,-23.6892226,-46.6870314,SAO PAULO,Metropolitana de São Paulo,,,,1.0,,,,1.0,,,,,PREFEITURA,PREFEITURA,MUNICIPAL,OUTROS,,,,,,,,,,,S,,0
417432,1903426,SINISTRO NAO FATAL,03/02/2024,2024,2,3,2024/02,01:36,SP 348,68.0,RODOVIAS,-23.1201312,-46.989962,JUNDIAI,Campinas,,1.0,,,,2.0,,,1.0,,,,CONCESSIONÁRIA,AUTOBAN,ESTADUAL,CHOQUE,,,,,,,S,,,,,,0
188788,2195660,SINISTRO NAO FATAL,24/12/2022,2022,12,24,2022/12,10:12,RUA NEI CARLOS SIMI,87.0,VIAS MUNICIPAIS,-23.4497687065,-47.4685232244,SOROCABA,Sorocaba,,,1.0,,,,1.0,1.0,1.0,,,,PREFEITURA,PREFEITURA,MUNICIPAL,COLISAO,,,,S,,,,,,,,,0
123816,1633369,SINISTRO NAO FATAL,27/08/2022,2022,8,27,2022/08,16:39,AVENIDA PAULISTA,100.0,VIAS MUNICIPAIS,-22.75399504,-47.16551343,PAULINIA,Campinas,,,1.0,,,,,,2.0,,,,PREFEITURA,PREFEITURA,MUNICIPAL,OUTROS,,,,,,,,,,,S,,0
598185,2412963,SINISTRO NAO FATAL,30/12/2024,2024,12,30,2024/12,14:48,SP 294,616.0,RODOVIAS,-21.55814291,-51.24134148,PACAEMBU,Presidente Prudente,,,1.0,,,,,,2.0,,,,CONCESSIONÁRIA,EIXOSP - PIPA,ESTADUAL,OUTROS,,,,,,,,,,S,,,0
302184,1592399,SINISTRO NAO FATAL,19/07/2023,2023,7,19,2023/07,22:17,ESTRADA BONSUCESSO,31.0,VIAS MUNICIPAIS,-23.4669858,-46.34974355,ITAQUAQUECETUBA,Metropolitana de São Paulo,,,1.0,,,,1.0,1.0,,,,1.0,PREFEITURA,PREFEITURA,MUNICIPAL,COLISAO,,,,S,,,,,,,,,1
31859,1582015,SINISTRO NAO FATAL,10/03/2022,2022,3,10,2022/03,19:23,AVENIDA DO ESTADO,100.0,VIAS MUNICIPAIS,-23.5216076,-46.63789744,SAO PAULO,Metropolitana de São Paulo,,,1.0,,,,1.0,1.0,1.0,,,,PREFEITURA,PREFEITURA,MUNICIPAL,NAO DISPONIVEL,,,,,,,,,,,,S,0
546310,2396237,NOTIFICACAO,23/09/2024,2024,9,23,2024/09,17:53,AVENIDA COMENDADOR PEREIRA INÁCIO,100.0,VIAS MUNICIPAIS,-23.50658,-47.45645,SOROCABA,Sorocaba,,,,,,,,,,,,,PREFEITURA,PREFEITURA,MUNICIPAL,OUTROS,,,,,,,,,,,S,,0
276260,1710786,NOTIFICACAO,07/06/2023,2023,6,7,2023/06,20:40,VIA PARQUE,8055.0,VIAS MUNICIPAIS,-23.495176,-46.519444,SAO PAULO,Metropolitana de São Paulo,,,,,,,,,,,,,PREFEITURA,PREFEITURA,MUNICIPAL,OUTROS,,,,,,,,,,,S,,0
128719,2468598,SINISTRO FATAL,04/09/2022,2022,9,4,2022/09,14:00,ESTRADA MUNICIPAL PEROBAS/JOSÉ BONIFACIO,,VIAS MUNICIPAIS,,,JACI,São José do Rio Preto,,,1.0,,,,,,,1.0,,,PREFEITURA,PREFEITURA,MUNICIPAL,COLISAO,,,S,,,,,,,,,S,1
337410,1721173,SINISTRO NAO FATAL,16/09/2023,2023,9,16,2023/09,20:11,AV BRASIL,1.0,VIAS MUNICIPAIS,-20.89870143,-49.26882209,CEDRAL,São José do Rio Preto,,,1.0,,,,1.0,2.0,,,,1.0,PREFEITURA,PREFEITURA,MUNICIPAL,COLISAO,,S,,,,,,,,,,,1
95377,1568883,SINISTRO NAO FATAL,05/07/2022,2022,7,5,2022/07,19:04,AVENIDA HUMBERTO ALENÇAR CASTELO BRANCO,2580.0,VIAS MUNICIPAIS,-23.7148425,-46.58616689,SAO BERNARDO DO CAMPO,Metropolitana de São Paulo,,,1.0,,,,1.0,3.0,1.0,,,,PREFEITURA,PREFEITURA,MUNICIPAL,COLISAO,,S,,S,,,,,,,S,,0
338314,1456286,NOTIFICACAO,17/09/2023,2023,9,17,2023/09,12:12,RUA ZUFEREY,1640.0,VIAS MUNICIPAIS,-23.209675,-46.86881,JUNDIAI,Campinas,,,,,,,,,,,,,PREFEITURA,PREFEITURA,MUNICIPAL,OUTROS,,,,,,,,,,,S,,0
122964,2184968,SINISTRO NAO FATAL,25/08/2022,2022,8,25,2022/08,11:10,RUA SEBASTIÃO FERREIRA DOS SANTOS,10.0,VIAS MUNICIPAIS,-23.47709898,-46.35331655,ITAQUAQUECETUBA,Metropolitana de São Paulo,,,,,,,2.0,,2.0,,,,PREFEITURA,PREFEITURA,MUNICIPAL,COLISAO,,,S,,,,,,,,,,0
176044,1372272,NOTIFICACAO,01/12/2022,2022,12,1,2022/12,17:21,RUA INDIAPORA,92.0,VIAS MUNICIPAIS,-23.4939012334,-46.702600326,SAO PAULO,Metropolitana de São Paulo,,,,,,,,,,,,,PREFEITURA,PREFEITURA,MUNICIPAL,OUTROS,,,,,,,,,,,S,,0
435400,1571542,NOTIFICACAO,07/03/2024,2024,3,7,2024/03,16:37,AVENIDA MAJOR JOSÉ LEVI SOBRINHO,2595.0,VIAS MUNICIPAIS,-22.549527,-47.3792496,LIMEIRA,Campinas,,,,,,,,,,,,,PREFEITURA,PREFEITURA,MUNICIPAL,NAO DISPONIVEL,,,,,,,,,,,,S,0
312346,1775296,NOTIFICACAO,04/08/2023,2023,8,4,2023/08,23:10,RUA MARIA CARVALHO DE LIMA,492.0,VIAS MUNICIPAIS,-23.498526,-46.79183,OSASCO,Metropolitana de São Paulo,,,,,,,,,,,,,PREFEITURA,PREFEITURA,MUNICIPAL,OUTROS,,,,,,,,,,,S,,0
659439,2600411,SINISTRO NAO FATAL,08/05/2025,2025,5,8,2025/05,19:22,MARGINAL PINHEIROS,1853.0,VIAS MUNICIPAIS,-23.5513,-46.7279,SAO PAULO,Metropolitana de São Paulo,,,1.0,,,,1.0,1.0,1.0,,,,PREFEITURA,PREFEITURA,MUNICIPAL,COLISAO,,,,S,,,,,,,S,,0
135518,1708097,SINISTRO NAO FATAL,17/09/2022,2022,9,17,2022/09,20:48,MELLO PEIXOTO,1001.0,VIAS MUNICIPAIS,-22.9977814,-49.8578105,OURINHOS,Marília,1.0,,1.0,,,,,,2.0,,,,PREFEITURA,PREFEITURA,MUNICIPAL,COLISAO,,,,,S,,,,,,,,0
372528,1309649,NOTIFICACAO,15/11/2023,2023,11,15,2023/11,13:19,RUA SÃO FRANCISCO,1195.0,VIAS MUNICIPAIS,-21.1461134,-47.8173467,RIBEIRAO PRETO,Ribeirão Preto,,,,,,,,,,,,,PREFEITURA,PREFEITURA,MUNICIPAL,OUTROS,,,,,,,,,,,S,,0
373597,1731704,SINISTRO NAO FATAL,16/11/2023,2023,11,16,2023/11,22:10,DEPUTADO CUNHA BUENO,50.0,VIAS MUNICIPAIS,-21.2842812,-48.2504619,JABOTICABAL,Ribeirão Preto,,2.0,,,,3.0,,1.0,1.0,,,,PREFEITURA,PREFEITURA,MUNICIPAL,COLISAO,,,S,,,,,,,,,,0
298700,1981197,SINISTRO NAO FATAL,13/07/2023,2023,7,13,2023/07,07:06,SP 083,5.0,RODOVIAS,-22.93512819,-47.01022734,CAMPINAS,Campinas,,,1.0,,,,1.0,1.0,1.0,,,,CONCESSIONÁRIA,ROTA DAS BANDEIRAS,ESTADUAL,COLISAO,,,,S,,,,,,S,,,0
169972,1637058,SINISTRO NAO FATAL,20/11/2022,2022,11,20,2022/11,17:26,RUA JOSE STANDLAU DE OLIVEIRA,527.0,VIAS MUNICIPAIS,-22.559171883,-47.937115301,SAO PEDRO,Campinas,,,,,,,2.0,1.0,1.0,,,,PREFEITURA,PREFEITURA,MUNICIPAL,COLISAO,,,,S,,,,,,,S,,0
524528,2379686,SINISTRO NAO FATAL,14/08/2024,2024,8,14,2024/08,21:38,RUA DEPUTADO EMÍLIO CARLOS,580.0,VIAS MUNICIPAIS,-23.5428105,-46.7678874,OSASCO,Metropolitana de São Paulo,,,1.0,,,,1.0,2.0,2.0,,,,PREFEITURA,PREFEITURA,MUNICIPAL,COLISAO,,S,,,,,S,,,,S,,0
300101,2520433,SINISTRO NAO FATAL,15/07/2023,2023,7,15,2023/07,22:30,SP 330,123.0,RODOVIAS,-22.74005598,-47.27315937,AMERICANA,Campinas,,,,,,,2.0,2.0,1.0,,,,DER,13.02,ESTADUAL,COLISAO,,,S,,,,,,,,,,0
307458,1705321,NOTIFICACAO,28/07/2023,2023,7,28,2023/07,20:31,AVENIDA PRESIDENTE CASTELO BRANCO,7174.0,VIAS MUNICIPAIS,-23.51418026,-46.67913759,SAO PAULO,Metropolitana de São Paulo,,,,,,,,,,,,,PREFEITURA,PREFEITURA,MUNICIPAL,OUTROS,,,,,,,,,,,S,,0
73894,2026199,SINISTRO NAO FATAL,27/05/2022,2022,5,27,2022/05,09:18,SP 055,305.0,RODOVIAS,-24.09517923,-46.62627234,MONGAGUA,Baixada Santista,,,,,,,2.0,2.0,1.0,,,,ARTESP,NOVO LITORAL,ESTADUAL,COLISAO,,,S,,,,,,,,,,0
124815,1713497,NOTIFICACAO,28/08/2022,2022,8,28,2022/08,00:41,AVENIDA LENIN,182.0,VIAS MUNICIPAIS,-23.27399046,-45.88905616,SAO JOSE DOS CAMPOS,São José dos Campos,,,,,,,,,,,,,PREFEITURA,PREFEITURA,MUNICIPAL,OUTROS,,,,,,,,,,,S,,0
642588,2582150,NOTIFICACAO,05/04/2025,2025,4,5,2025/04,14:28,AVENIDA BRASIL,601.0,VIAS MUNICIPAIS,-23.53513,-46.1908681,MOGI DAS CRUZES,Metropolitana de São Paulo,,,,,,,,,,,,,PREFEITURA,PREFEITURA,MUNICIPAL,NAO DISPONIVEL,,,,,,,,,,,,S,0
428652,1610051,NOTIFICACAO,24/02/2024,2024,2,24,2024/02,17:18,RUA CARMINHA CELESTINA DA SILVA,322.0,VIAS MUNICIPAIS,-23.5742688,-47.4625814,VOTORANTIM,Sorocaba,1.0,,,,,,,,,,,1.0,PREFEITURA,PREFEITURA,MUNICIPAL,ATROPELAMENTO,S,,,,,,,,,,,,1
536695,2393655,SINISTRO NAO FATAL,06/09/2024,2024,9,6,2024/09,16:13,RUA QUATRO,10.0,VIAS MUNICIPAIS,-20.7196324,-47.8851069,ORLANDIA,Franca,,,1.0,,,,1.0,1.0,2.0,,,,PREFEITURA,PREFEITURA,MUNICIPAL,COLISAO,,,,S,,,,,,,,,0
663289,2596583,SINISTRO NAO FATAL,15/05/2025,2025,5,15,2025/05,16:55,AVENIDA 9 DE JULHO,192.0,VIAS MUNICIPAIS,-23.1777886,-46.9003635,JUNDIAI,Campinas,,,1.0,,,,1.0,1.0,1.0,,,,PREFEITURA,PREFEITURA,MUNICIPAL,COLISAO,,,,S,,,,,,,,,0
244645,1976002,NOTIFICACAO,14/04/2023,2023,4,14,2023/04,08:55,RUA PADRE JULIÃO,261.0,VIAS MUNICIPAIS,-22.19086085,-47.39476549,LEME,Campinas,,,,,,,,,,,,,PREFEITURA,PREFEITURA,MUNICIPAL,NAO DISPONIVEL,,,,,,,,,,,,S,0
511390,2476741,SINISTRO FATAL,20/07/2024,2024,7,20,2024/07,12:42,RUA DO PÔRTO,263.0,VIAS MUNICIPAIS,-23.0932651251,-45.7094134318,CACAPAVA,São José dos Campos,,,,,,,1.0,,,1.0,,,PREFEITURA,PREFEITURA,MUNICIPAL,CHOQUE,,,,,,,S,,,,S,,1
209054,1564668,SINISTRO NAO FATAL,06/02/2023,2023,2,6,2023/02,19:43,CASA DO QUEIJO  PEDRO EROLES  4685,47.0,VIAS MUNICIPAIS,-23.4828529,-46.2314644,MOGI DAS CRUZES,Metropolitana de São Paulo,,,1.0,,,,1.0,1.0,1.0,,,,PREFEITURA,PREFEITURA,MUNICIPAL,COLISAO,,,S,,,,,,,S,,,0
84037,1975674,SINISTRO NAO FATAL,14/06/2022,2022,6,14,2022/06,00:00,BR 116,66.7,RODOVIAS,-22.8218879355,-45.1961049763,GUARATINGUETA,São José dos Campos,,,,,,,1.0,1.0,,,,,CONCESSIONÁRIA,NOVADUTRA,FEDERAL,OUTROS,,,,,,,,,,,S,,0
266617,2197931,SINISTRO NAO FATAL,23/05/2023,2023,5,23,2023/05,13:14,RUA PARANÁ,350.0,VIAS MUNICIPAIS,-21.16177364,-47.81995141,RIBEIRAO PRETO,Ribeirão Preto,,,,1.0,,,,1.0,,,,,PREFEITURA,PREFEITURA,MUNICIPAL,OUTROS,,,,,,,,,,,S,,0
420414,1593641,SINISTRO NAO FATAL,09/02/2024,2024,2,9,2024/02,19:07,VICINAL DE ANHUMAS PARA PIRAPO,1.0,VIAS MUNICIPAIS,-22.29592767,-51.38742042,ANHUMAS,Presidente Prudente,,,,,,,1.0,,1.0,,,,PREFEITURA,PREFEITURA,MUNICIPAL,OUTROS,,,,,,,,S,,,,,0
14199,1964531,SINISTRO NAO FATAL,04/02/2022,2022,2,4,2022/02,08:21,AVENIDA EMBAIXADOR MACEDO SOARES,1.0,VIAS MUNICIPAIS,-23.51366283,-46.72286,SAO PAULO,Metropolitana de São Paulo,,,,,,,2.0,,2.0,,,,PREFEITURA,PREFEITURA,MUNICIPAL,COLISAO,,,,S,,,,,,,,,0
431310,2204459,NOTIFICACAO,28/02/2024,2024,2,28,2024/02,12:28,RUA ANTÔNIO SARAIVA,374.0,VIAS MUNICIPAIS,-23.67232496,-46.74811738,SAO PAULO,Metropolitana de São Paulo,,,,,,,,,,,,,PREFEITURA,PREFEITURA,MUNICIPAL,NAO DISPONIVEL,,,,,,,,,,,,S,0
110396,1788952,NOTIFICACAO,02/08/2022,2022,8,2,2022/08,06:26,MARECHAL RONDON,340.0,VIAS MUNICIPAIS,-22.34325439,-49.07711639,BAURU,Bauru,,,,,,,,,,,,,PREFEITURA,PREFEITURA,MUNICIPAL,OUTROS,,,,,,,,,,,S,,0
73296,2065760,SINISTRO NAO FATAL,26/05/2022,2022,5,26,2022/05,11:13,AVENIDA CEL JOSÉ SOARES MARCONDES,10.0,VIAS MUNICIPAIS,-22.14337425,-51.39986183,PRESIDENTE PRUDENTE,Presidente Prudente,,,1.0,1.0,,,1.0,1.0,,,,1.0,PREFEITURA,PREFEITURA,MUNICIPAL,COLISAO,,S,,S,,,,,,,S,,1
74335,2363525,NOTIFICACAO,28/05/2022,2022,5,28,2022/05,08:35,RUA IPIRANGA,353.0,VIAS MUNICIPAIS,-23.96573915,-46.38767975,SAO VICENTE,Baixada Santista,,,,,,,,,,,,,PREFEITURA,PREFEITURA,MUNICIPAL,OUTROS,,,,,,,,,,,S,S,0
171533,1968290,SINISTRO NAO FATAL,23/11/2022,2022,11,23,2022/11,00:00,BR 116,145.0,RODOVIAS,-23.1749791386,-45.8303064477,SAO JOSE DOS CAMPOS,São José dos Campos,,,,,,,1.0,,1.0,,,,CONCESSIONÁRIA,NOVADUTRA,FEDERAL,COLISAO,,,S,,,,,,,,,,0
385285,1552558,NOTIFICACAO,07/12/2023,2023,12,7,2023/12,17:53,AVENIDA CÁSPER LÍBERO,232.0,VIAS MUNICIPAIS,-21.200516,-47.840687,RIBEIRAO PRETO,Ribeirão Preto,,,,,,,,,,,,,PREFEITURA,PREFEITURA,MUNICIPAL,OUTROS,,,,,,,,,,,S,,0
275853,2148584,SINISTRO NAO FATAL,06/06/2023,2023,6,6,2023/06,11:50,SP 294,568.0,RODOVIAS,-21.77260781,-50.85933664,OSVALDO CRUZ,Presidente Prudente,,,,,,,2.0,2.0,,,,,CONCESSIONÁRIA,EIXOSP - PIPA,ESTADUAL,COLISAO,,,S,,,,,,,,,,0
348487,1826341,NOTIFICACAO,05/10/2023,2023,10,5,2023/10,07:17,RUA DA INDÚSTRIA,475.0,VIAS MUNICIPAIS,-23.7098671,-46.5176303,SANTO ANDRE,Metropolitana de São Paulo,,,,,,,,,,,,,PREFEITURA,PREFEITURA,MUNICIPAL,OUTROS,,,,,,,,,,,S,,0
253400,2115918,NOTIFICACAO,30/04/2023,2023,4,30,2023/04,05:38,AVENIDA LUIZ DUMONT VILLARES,950.0,VIAS MUNICIPAIS,-23.49397301,-46.61159198,SAO PAULO,Metropolitana de São Paulo,,,,,,,,,,,,,PREFEITURA,PREFEITURA,MUNICIPAL,OUTROS,,,,,,,,,,,S,,0
253809,1766790,NOTIFICACAO,01/05/2023,2023,5,1,2023/05,21:31,RUA ARARAQUARA,737.0,VIAS MUNICIPAIS,-23.14105222,-46.56109361,ATIBAIA,Campinas,,,,,,,,,,,,,PREFEITURA,PREFEITURA,MUNICIPAL,OUTROS,,,,,,,,,,,S,,0
618184,2550499,NOTIFICACAO,14/02/2025,2025,2,14,2025/02,20:26,RUA EDUARDO NOGUEIRA,450.0,VIAS MUNICIPAIS,-22.873802,-47.0343209,CAMPINAS,Campinas,,,,,,,,,,,,,PREFEITURA,PREFEITURA,MUNICIPAL,NAO DISPONIVEL,,,,,,,,,,,,S,0
604882,2512673,NOTIFICACAO,16/01/2025,2025,1,16,2025/01,18:27,PRESIDENTE CASTELLO BRANCO,26.0,VIAS MUNICIPAIS,-23.5095065,-46.8170991,BARUERI,Metropolitana de São Paulo,,,,,,,,,,,,,PREFEITURA,PREFEITURA,MUNICIPAL,NAO DISPONIVEL,,,,,,,,,,,,S,0
244462,2044273,SINISTRO NAO FATAL,14/04/2023,2023,4,14,2023/04,08:28,RUA ITORORO,555.0,VIAS MUNICIPAIS,-23.19255606,-45.87858335,SAO JOSE DOS CAMPOS,São José dos Campos,,,,,,,2.0,1.0,1.0,,,,PREFEITURA,PREFEITURA,MUNICIPAL,COLISAO,,S,,S,,,,,,,,,0
639689,2569406,SINISTRO NAO FATAL,30/03/2025,2025,3,30,2025/03,19:50,RUA PROJETADA 1,64.0,VIAS MUNICIPAIS,-23.45234,-46.6957708,SAO PAULO,Metropolitana de São Paulo,,,,,,,,,,,,,PREFEITURA,PREFEITURA,MUNICIPAL,OUTROS,,,,,,,,,,,S,,0
423580,2259037,NOTIFICACAO,14/02/2024,2024,2,14,2024/02,14:29,RUA NICOLAU TOLENTINO DE ALMEIDA,61.0,VIAS MUNICIPAIS,-23.4686283,-46.6663777,SAO PAULO,Metropolitana de São Paulo,,,,,,,,,1.0,,,,PREFEITURA,PREFEITURA,MUNICIPAL,OUTROS,,,,,,,,,,S,,,0
328819,1807818,SINISTRO NAO FATAL,02/09/2023,2023,9,2,2023/09,20:29,AVENIDA CÔNEGO MANOEL ALVES,1.0,VIAS MUNICIPAIS,-22.561764,-47.422363,LIMEIRA,Campinas,,,1.0,,,,,,,,,1.0,PREFEITURA,PREFEITURA,MUNICIPAL,COLISAO,,S,,,,,,,,,,,1
127014,1472365,NOTIFICACAO,02/09/2022,2022,9,2,2022/09,17:00,ENGENHEIRO CONSTANCIO CINTRA,99.0,VIAS MUNICIPAIS,-23.03982296,-46.84505062,ITATIBA,Campinas,,,,,,,,,,,,,PREFEITURA,PREFEITURA,MUNICIPAL,OUTROS,,,,,,,,,,,S,,0
114793,1852819,SINISTRO NAO FATAL,10/08/2022,2022,8,10,2022/08,07:24,RUA R LOPES,42.0,VIAS MUNICIPAIS,-22.1435,-51.4511,PRESIDENTE PRUDENTE,Presidente Prudente,,,,1.0,,,,1.0,,,,,PREFEITURA,PREFEITURA,MUNICIPAL,OUTROS,,,,,,,,,,,S,,0
259089,1789556,SINISTRO NAO FATAL,10/05/2023,2023,5,10,2023/05,05:37,RUA KOICHI MATSUMURA,10.0,VIAS MUNICIPAIS,-23.22598524,-45.89728836,SAO JOSE DOS CAMPOS,São José dos Campos,1.0,,,1.0,,,1.0,2.0,1.0,,,,PREFEITURA,PREFEITURA,MUNICIPAL,CHOQUE,,,,,,,S,,,,S,,0
582909,2452943,SINISTRO NAO FATAL,29/11/2024,2024,11,29,2024/11,12:36,AVENIDA PRESTES MAIA,1112.0,VIAS MUNICIPAIS,-23.6482142,-46.5466885,SANTO ANDRE,Metropolitana de São Paulo,,,1.0,,,,1.0,1.0,1.0,,,,PREFEITURA,PREFEITURA,MUNICIPAL,COLISAO,,S,,,,,,,,,S,,0
386393,1426031,SINISTRO NAO FATAL,08/12/2023,2023,12,8,2023/12,17:09,RUA MONSENHOR ALVES,345.0,VIAS MUNICIPAIS,-20.8956266,-47.5847763,BATATAIS,Franca,,,,2.0,,,,1.0,,,,,PREFEITURA,PREFEITURA,MUNICIPAL,OUTROS,,,,,,,,,,,S,,0
136855,2203757,SINISTRO NAO FATAL,19/09/2022,2022,9,19,2022/09,15:09,RUA PORTO SABAUNA,247.0,VIAS MUNICIPAIS,-23.60052372,-46.5638357,SAO PAULO,Metropolitana de São Paulo,,,1.0,,,,1.0,2.0,1.0,,,,PREFEITURA,PREFEITURA,MUNICIPAL,COLISAO,,S,,S,,,,,,,,,0
324434,1709115,SINISTRO NAO FATAL,25/08/2023,2023,8,25,2023/08,03:02,VICINAL VIRGILIO HOLTIS,32.0,VIAS MUNICIPAIS,-24.31824558,-49.14557272,BOM SUCESSO DE ITARARE,Itapeva,,,,,,,1.0,,1.0,,,,PREFEITURA,PREFEITURA,MUNICIPAL,COLISAO,,S,S,S,,,,,,,,,0
174994,2081976,SINISTRO NAO FATAL,29/11/2022,2022,11,29,2022/11,11:01,AVENIDA DOS TRABALHADORES,1281.0,VIAS MUNICIPAIS,-22.3701691748,-46.938355517,MOGI GUACU,Campinas,,,1.0,,,,1.0,2.0,1.0,,,,PREFEITURA,PREFEITURA,MUNICIPAL,COLISAO,,,,S,,,,,,,S,,0
6647,2073181,SINISTRO NAO FATAL,18/01/2022,2022,1,18,2022/01,10:11,AVENIDA DOS AUTONOMISTAS,3669.0,VIAS MUNICIPAIS,-23.52666875,-46.79708825,OSASCO,Metropolitana de São Paulo,,,1.0,,,,1.0,1.0,1.0,,,,PREFEITURA,PREFEITURA,MUNICIPAL,COLISAO,,S,,,,,,,,,,,0
143257,1466930,SINISTRO NAO FATAL,01/10/2022,2022,10,1,2022/10,15:32,RUA EDMUNDO KRUG,77.0,VIAS MUNICIPAIS,-23.4811898,-46.67386259,SAO PAULO,Metropolitana de São Paulo,,,1.0,,,,1.0,1.0,1.0,,,,PREFEITURA,PREFEITURA,MUNICIPAL,COLISAO,,,,S,,,,,,,S,,0
559951,2414591,SINISTRO NAO FATAL,17/10/2024,2024,10,17,2024/10,15:02,RUA DOMINGOS ZANIN,100.0,VIAS MUNICIPAIS,-21.8163167,-48.177614,ARARAQUARA,Central,,,1.0,,,,1.0,2.0,1.0,,,,PREFEITURA,PREFEITURA,MUNICIPAL,COLISAO,,S,,S,,,,,,,S,,0
347319,2147343,NOTIFICACAO,03/10/2023,2023,10,3,2023/10,15:18,RUA IRMÃ DIVA PATARRA,379.0,VIAS MUNICIPAIS,-22.1689955,-47.3824457,LEME,Campinas,,,,,,,,,,,,,PREFEITURA,PREFEITURA,MUNICIPAL,OUTROS,,,,,,,,,,,S,,0
258996,1905497,SINISTRO NAO FATAL,10/05/2023,2023,5,10,2023/05,07:50,RUA ORLANDO PENATTI,589.0,VIAS MUNICIPAIS,-22.75452906,-47.43320429,SANTA BARBARA D OESTE,Campinas,,,1.0,,,,1.0,1.0,1.0,,,,PREFEITURA,PREFEITURA,MUNICIPAL,COLISAO,,,,S,,,,,,,S,,0
478592,2333694,SINISTRO NAO FATAL,23/05/2024,2024,5,23,2024/05,06:21,RUA JOSE CAMILO,10.0,VIAS MUNICIPAIS,-22.5122952,-52.1178326,TEODORO SAMPAIO,Presidente Prudente,1.0,,1.0,1.0,,,,1.0,1.0,,,,PREFEITURA,PREFEITURA,MUNICIPAL,COLISAO,,,,S,,,,,,,S,,0
196361,1716512,SINISTRO NAO FATAL,11/01/2023,2023,1,11,2023/01,00:10,CARLOS DE ARRUDA GARMES,8.0,VIAS MUNICIPAIS,-22.40735598,-51.52621977,NARANDIBA,Presidente Prudente,,,,,,,1.0,,4.0,,,,PREFEITURA,PREFEITURA,MUNICIPAL,OUTROS,,,,,,,,S,,,,,0
306729,2177455,SINISTRO NAO FATAL,26/07/2023,2023,7,26,2023/07,11:38,RUA GUAICURUS,153.0,VIAS MUNICIPAIS,-23.523287,-46.687122,SAO PAULO,Metropolitana de São Paulo,,,,1.0,,,,1.0,,,,,PREFEITURA,PREFEITURA,MUNICIPAL,OUTROS,,,,,,,,,,,S,S,0
506646,2275235,SINISTRO NAO FATAL,12/07/2024,2024,7,12,2024/07,17:24,ESTRADA PRESIDENTE JUSCELINO KUBITSCHECK DE OLIVEI,2867.0,VIAS MUNICIPAIS,-23.4544484,-46.4071942,GUARULHOS,Metropolitana de São Paulo,1.0,,,1.0,,,1.0,1.0,1.0,,,,PREFEITURA,PREFEITURA,MUNICIPAL,ATROPELAMENTO,S,,,,,,,,,,S,,0
159520,1620680,NOTIFICACAO,31/10/2022,2022,10,31,2022/10,19:38,RUA PASSEIO DOS IPÊS  BELA VISTA SÃOCARLENSE  R,100.0,VIAS MUNICIPAIS,-22.01834,-47.91696,SAO CARLOS,Central,,,,,,,,,,,,,PREFEITURA,PREFEITURA,MUNICIPAL,OUTROS,,,,,,,,,,,S,,0
666810,2597615,SINISTRO NAO FATAL,22/05/2025,2025,5,22,2025/05,17:31,RUA LUIS DE CAMARGO BARROS,15.0,VIAS MUNICIPAIS,-23.3357174,-47.8601981,TATUI,Sorocaba,,,1.0,,,,,,2.0,,,,PREFEITURA,PREFEITURA,MUNICIPAL,NAO DISPONIVEL,,,,,,,,,,,,S,0
76699,1805674,SINISTRO NAO FATAL,01/06/2022,2022,6,1,2022/06,06:07,SP 270,30.0,RODOVIAS,-23.59873538,-46.89005889,COTIA,Metropolitana de São Paulo,,,1.0,,,,1.0,1.0,,,,1.0,NAO DISPONIVEL,NAO DISPONIVEL,ESTADUAL,COLISAO,,,,,S,,,,,S,,,1
394620,2115643,SINISTRO NAO FATAL,21/12/2023,2023,12,21,2023/12,10:51,RUA ADOLFO ET,10.0,VIAS MUNICIPAIS,-21.41248663,-50.07443222,PENAPOLIS,Araçatuba,,,1.0,,,,1.0,1.0,1.0,,,,PREFEITURA,PREFEITURA,MUNICIPAL,COLISAO,,,,S,,,,,,,S,,0
183595,1422763,SINISTRO NAO FATAL,15/12/2022,2022,12,15,2022/12,17:57,ACESSO PONTE AVENIDA VEREADORA ANGELINA PRETI DA S,1.0,VIAS MUNICIPAIS,-23.961228984,-46.412861726,SAO VICENTE,Baixada Santista,1.0,,1.0,,,,1.0,1.0,1.0,,,,PREFEITURA,PREFEITURA,MUNICIPAL,COLISAO,,,S,,,,,,,,,,0
463349,1999193,NOTIFICACAO,26/04/2024,2024,4,26,2024/04,11:25,RUA GUANIQUÉ,10.0,VIAS MUNICIPAIS,-23.6259689,-46.5981841,SAO PAULO,Metropolitana de São Paulo,,,,,,,,,,,,,PREFEITURA,PREFEITURA,MUNICIPAL,NAO DISPONIVEL,,,,,,,,,,,,S,0
300701,1853774,SINISTRO NAO FATAL,16/07/2023,2023,7,16,2023/07,21:33,SPIRITO STO X ALBERTINA,1.0,VIAS MUNICIPAIS,-22.20087868,-46.75359044,ESPIRITO SANTO DO PINHAL,Campinas,,,,,,,1.0,,1.0,,,,PREFEITURA,PREFEITURA,MUNICIPAL,OUTROS,,,,,,,,,,,S,,0
476531,2327743,NOTIFICACAO,19/05/2024,2024,5,19,2024/05,19:56,RUA ABRÃO DINIZ,1.0,VIAS MUNICIPAIS,-20.317422,-47.78638,ITUVERAVA,Franca,,,,,,,,,,,,,PREFEITURA,PREFEITURA,MUNICIPAL,OUTROS,,,,,,,,,,,S,,0
567152,2444223,NOTIFICACAO,30/10/2024,2024,10,30,2024/10,09:30,VIADUTO DO GLICÉRIO,10.0,VIAS MUNICIPAIS,-23.5562026,-46.6321036,SAO PAULO,Metropolitana de São Paulo,,,,,,,,,,,,,PREFEITURA,PREFEITURA,MUNICIPAL,OUTROS,,,,,,,,,,,S,,0
491122,2263626,SINISTRO NAO FATAL,14/06/2024,2024,6,14,2024/06,13:32,AVENIDA MANOEL GOULART,2400.0,VIAS MUNICIPAIS,-22.1173224,-51.4054186,PRESIDENTE PRUDENTE,Presidente Prudente,,,,1.0,,,,1.0,,,,,PREFEITURA,PREFEITURA,MUNICIPAL,OUTROS,,,,,,,,,,,S,,0
500482,2266291,NOTIFICACAO,30/06/2024,2024,6,30,2024/06,07:41,SP 280,10.0,RODOVIAS,-23.5204631,-46.7779893,OSASCO,Metropolitana de São Paulo,,,,,,,,,,,,,DER,10.02,ESTADUAL,OUTROS,,,,,,,,,,,S,,0
204566,1711505,SINISTRO NAO FATAL,28/01/2023,2023,1,28,2023/01,19:28,PRAÇA ARMANDO PAULA DE ASSIS,100.0,VIAS MUNICIPAIS,-23.11468305,-48.92809949,AVARE,Sorocaba,,,1.0,,,,1.0,1.0,1.0,,,,PREFEITURA,PREFEITURA,MUNICIPAL,COLISAO,,S,,,,,,,,,,,0
479556,2319723,NOTIFICACAO,24/05/2024,2024,5,24,2024/05,08:13,SP 065,145.0,RODOVIAS,-22.8573484,-47.1364664,CAMPINAS,Campinas,,,,,,,,,,,,,CONCESSIONÁRIA,ROTA DAS BANDEIRAS,ESTADUAL,OUTROS,,,,,,,,,,,S,,0
27088,2028077,SINISTRO NAO FATAL,28/02/2022,2022,2,28,2022/02,06:54,RUA SILVARES,0.0,VIAS MUNICIPAIS,-21.2854046,-50.33726712,BIRIGUI,Araçatuba,,,1.0,,,,,,1.0,,,,PREFEITURA,PREFEITURA,MUNICIPAL,COLISAO,,,,S,,,,,,,,,0
276665,1879395,NOTIFICACAO,07/06/2023,2023,6,7,2023/06,07:16,"ORLÂNDIA  ORLÂNDIA, STATE OF SÃO PAULO, 14620",0.0,VIAS MUNICIPAIS,-20.71723,-47.880314,ORLANDIA,Franca,,,,,,,,,,,,,PREFEITURA,PREFEITURA,MUNICIPAL,OUTROS,,,,,,,,,,,S,,0
263600,1337101,SINISTRO NAO FATAL,18/05/2023,2023,5,18,2023/05,16:13,AVENIDA DOUTORA RUTH CARDOSO,6843.0,VIAS MUNICIPAIS,-23.560963,-46.705166,SAO PAULO,Metropolitana de São Paulo,,,1.0,,,,,,1.0,,,,PREFEITURA,PREFEITURA,MUNICIPAL,OUTROS,,,,,,,,,,,S,,0
314461,1530385,SINISTRO NAO FATAL,09/08/2023,2023,8,9,2023/08,19:11,SP 360,116.0,RODOVIAS,-2268.0,-467756.0,AMPARO,Campinas,,,,1.0,,,,1.0,,,,,NAO DISPONIVEL,NAO DISPONIVEL,ESTADUAL,OUTROS,,,,,,,,,,,S,,0
627487,2558770,SINISTRO FATAL,05/03/2025,2025,3,5,2025/03,17:39,RODOVIA DO TRABALHADOR,10.0,VIAS MUNICIPAIS,-21.5744399951,-48.3742326927,MATAO,Central,,,1.0,,,,2.0,,,1.0,,,PREFEITURA,PREFEITURA,MUNICIPAL,COLISAO,,S,S,,,,,,,,,,1
226620,1418485,SINISTRO NAO FATAL,12/03/2023,2023,3,12,2023/03,12:59,RUA GUANABARA,224.0,VIAS MUNICIPAIS,-23.11934579,-46.58270433,ATIBAIA,Campinas,,,1.0,,,,1.0,1.0,1.0,,,,PREFEITURA,PREFEITURA,MUNICIPAL,COLISAO,,S,,,,,,,,,,,0
184790,1554112,SINISTRO NAO FATAL,17/12/2022,2022,12,17,2022/12,16:18,AVENIDA CARLOS CHAGAS,114.0,VIAS MUNICIPAIS,-23.655475317,-47.5747740391,SALTO DE PIRAPORA,Sorocaba,,,,,,,1.0,1.0,2.0,,,,PREFEITURA,PREFEITURA,MUNICIPAL,COLISAO,,S,,,,,,,,,,,0
391488,2141705,NOTIFICACAO,16/12/2023,2023,12,16,2023/12,08:10,RUA DESEMBARGADOR FAUSTO WHITAKER MACHADO ALVIM,432.0,VIAS MUNICIPAIS,-23.5035699,-46.3675411,SAO PAULO,Metropolitana de São Paulo,,,,,,,,,,,,,PREFEITURA,PREFEITURA,MUNICIPAL,OUTROS,,,,,,,,,,,S,,0
650670,2581402,NOTIFICACAO,20/04/2025,2025,4,20,2025/04,11:02,MONTEIRO LOBATO,3.755,VIAS MUNICIPAIS,-23.1136069,-45.9149254,SAO JOSE DOS CAMPOS,São José dos Campos,,,,,,,,,,,,,PREFEITURA,PREFEITURA,MUNICIPAL,NAO DISPONIVEL,,,,,,,,,,,,S,0
534310,2402600,SINISTRO NAO FATAL,01/09/2024,2024,9,1,2024/09,20:43,RUA TENENTE FAUSTINO,46.0,VIAS MUNICIPAIS,-23.5427694,-46.8369868,CARAPICUIBA,Metropolitana de São Paulo,,,,,,,1.0,1.0,1.0,,,,PREFEITURA,PREFEITURA,MUNICIPAL,COLISAO,,S,,,,,,,,,S,,0
363144,1511262,SINISTRO NAO FATAL,30/10/2023,2023,10,30,2023/10,18:47,RUA LOURIVAL RODRIGUES DA SILVA,105.0,VIAS MUNICIPAIS,-23.4944721,-46.3916456,SAO PAULO,Metropolitana de São Paulo,,,,1.0,,,,1.0,,,,,PREFEITURA,PREFEITURA,MUNICIPAL,OUTROS,,,,,,,,,,,S,,0
502,1367879,SINISTRO NAO FATAL,02/01/2022,2022,1,2,2022/01,00:47,AVENIDA GUIDO CALOI,300.0,VIAS MUNICIPAIS,-23.6485901,-46.7270908,SAO PAULO,Metropolitana de São Paulo,,,1.0,,,,,,1.0,,,,PREFEITURA,PREFEITURA,MUNICIPAL,OUTROS,,,,,,,,,,S,S,,0
333833,1670384,SINISTRO NAO FATAL,10/09/2023,2023,9,10,2023/09,17:44,"AV VICENTE DE CARVALHO, 10",10.0,VIAS MUNICIPAIS,-23.972557,-46.324917,SANTOS,Baixada Santista,,,1.0,,,,1.0,2.0,,,,,PREFEITURA,PREFEITURA,MUNICIPAL,COLISAO,,,S,,,,,,,,,,0
232870,1800543,SINISTRO NAO FATAL,23/03/2023,2023,3,23,2023/03,04:24,RUA CONSELHEIROA ANTONIO PADO,420.0,VIAS MUNICIPAIS,-21.1975604,-49.29337375,URUPES,São José do Rio Preto,,,1.0,,,,,,,,,1.0,PREFEITURA,PREFEITURA,MUNICIPAL,CHOQUE,,,,,,,S,,,,,,1
626890,2578641,SINISTRO NAO FATAL,03/03/2025,2025,3,3,2025/03,19:40,SP 543,569.0,RODOVIAS,-19.84804433,-50.3680763,FERNANDOPOLIS,São José do Rio Preto,,,,,,,,,,,,,DER,09.02,ESTADUAL,OUTROS,,,,,,,,,,,S,,0
620727,2561535,NOTIFICACAO,19/02/2025,2025,2,19,2025/02,17:07,SP 425,2.0,RODOVIAS,-22.27720164,-51.51954922,PIRAPOZINHO,Presidente Prudente,,,,,,,,,,,,,DER,12.01,ESTADUAL,NAO DISPONIVEL,,,,,,,,,,,,S,0
215649,2103950,NOTIFICACAO,18/02/2023,2023,2,18,2023/02,06:46,AVENIDA DOS REMÉDIOS,100.0,VIAS MUNICIPAIS,-23.52082747,-46.75023606,OSASCO,Metropolitana de São Paulo,,,,,,,,,,,,,PREFEITURA,PREFEITURA,MUNICIPAL,OUTROS,,,,,,,,,,,S,S,0
639537,2600513,SINISTRO NAO FATAL,30/03/2025,2025,3,30,2025/03,14:10,VELHA DO MAR,360.0,VIAS MUNICIPAIS,-23.7322,-46.4248,RIBEIRAO PIRES,Metropolitana de São Paulo,,,,,,,1.0,,1.0,,,,PREFEITURA,PREFEITURA,MUNICIPAL,OUTROS,,,,,,,,,,,S,,0
41836,1326939,NOTIFICACAO,28/03/2022,2022,3,28,2022/03,16:07,AVENIDA ITABERABA,1739.0,VIAS MUNICIPAIS,-23.49860918,-46.69816691,SAO PAULO,Metropolitana de São Paulo,,,,,,,,,,,,,PREFEITURA,PREFEITURA,MUNICIPAL,OUTROS,,,,,,,,,,,S,,0
600523,2568458,NOTIFICACAO,05/01/2025,2025,1,5,2025/01,20:33,SP 215,1.0,RODOVIAS,-21.84375365,-46.69230598,AGUAS DA PRATA,Campinas,,,,,,,,,,,,,DER,13.04,ESTADUAL,OUTROS,,,,,,,,,,,S,,0
519563,2383082,SINISTRO NAO FATAL,05/08/2024,2024,8,5,2024/08,02:38,SP 304,271.0,RODOVIAS,-22.3893207,-48.38716879,DOIS CORREGOS,Bauru,,,1.0,,,,,,,,,1.0,CONCESSIONÁRIA,EIXOSP - PIPA,ESTADUAL,OUTROS,,,,,,,,,,S,,,1
359703,1999418,SINISTRO NAO FATAL,24/10/2023,2023,10,24,2023/10,10:40,AVENIDA PEDRO FERRARI,1.0,VIAS MUNICIPAIS,-20.2762157,-50.2512756,FERNANDOPOLIS,São José do Rio Preto,,,1.0,,,,,,1.0,,,,PREFEITURA,PREFEITURA,MUNICIPAL,COLISAO,,,,,S,,,,,S,,,0
466076,2368775,SINISTRO NAO FATAL,01/05/2024,2024,5,1,2024/05,09:15,SP 160,42.0,RODOVIAS,-23.8159078,-46.5836961,SAO BERNARDO DO CAMPO,Metropolitana de São Paulo,,,1.0,,,,,1.0,1.0,,,,DER,10.01,ESTADUAL,COLISAO,,,,S,,,,,,S,,,0
623120,2553024,SINISTRO NAO FATAL,24/02/2025,2025,2,24,2025/02,03:37,AVENIDA ULISSES GUIMARAES,1182.0,VIAS MUNICIPAIS,-23.2932836,-46.7332057,FRANCISCO MORATO,Metropolitana de São Paulo,,,,,,,,,,,,,PREFEITURA,PREFEITURA,MUNICIPAL,COLISAO,,,,S,,,,,,,,,0
505359,2356851,SINISTRO NAO FATAL,09/07/2024,2024,7,9,2024/07,13:08,Rua Alba,1363.0,VIAS MUNICIPAIS,-23.647521,-46.6603695,SAO PAULO,Metropolitana de São Paulo,,,1.0,,,,1.0,2.0,1.0,,,,PREFEITURA,PREFEITURA,MUNICIPAL,COLISAO,,,S,,,,,,,,,,0
320114,1869007,NOTIFICACAO,18/08/2023,2023,8,18,2023/08,05:17,RUA JURUBIM,310.0,VIAS MUNICIPAIS,-23.48518983,-46.7484372,SAO PAULO,Metropolitana de São Paulo,,,,,,,,,,,,,PREFEITURA,PREFEITURA,MUNICIPAL,OUTROS,,,,,,,,,,,S,,0
507700,2467731,SINISTRO FATAL,14/07/2024,2024,7,14,2024/07,00:41,AVENIDA CUPECE,3601.0,VIAS MUNICIPAIS,-23.6684673239,-46.6507495196,SAO PAULO,Metropolitana de São Paulo,,,,,,,1.0,2.0,,1.0,,,PREFEITURA,PREFEITURA,MUNICIPAL,CHOQUE,,,,,,,S,,,,,S,1
371562,1963552,NOTIFICACAO,13/11/2023,2023,11,13,2023/11,07:52,AVENIDA DO CAFÉ,1.0,VIAS MUNICIPAIS,-21.1745809,-47.819356,RIBEIRAO PRETO,Ribeirão Preto,,,,,,,,,,,,,PREFEITURA,PREFEITURA,MUNICIPAL,OUTROS,,,,,,,,,,,S,,0
12028,1725994,SINISTRO NAO FATAL,30/01/2022,2022,1,30,2022/01,19:38,SP 300,10.0,RODOVIAS,-22.59169274,-48.78481459,LENCOIS PAULISTA,Bauru,,,,,,,1.0,,2.0,,,,DER,03.01,ESTADUAL,CHOQUE,,,,,,,S,,,,,,0
380690,2063609,SINISTRO NAO FATAL,29/11/2023,2023,11,29,2023/11,13:06,AVENIDA PRESBÍTERO MANOEL ANTÔNIO DIAS FILHO,467.0,VIAS MUNICIPAIS,-23.148237,-47.012535,JUNDIAI,Campinas,,,1.0,,,,1.0,1.0,1.0,,,,PREFEITURA,PREFEITURA,MUNICIPAL,COLISAO,,,,S,,,S,,,,S,,0
428722,1840302,SINISTRO NAO FATAL,24/02/2024,2024,2,24,2024/02,23:02,AVENIDA ENGENHEIRO SEBASTIÃO GUALBERTO,58.0,VIAS MUNICIPAIS,-23.1748575,-45.889371,SAO JOSE DOS CAMPOS,São José dos Campos,,,,,,,1.0,1.0,1.0,,,,PREFEITURA,PREFEITURA,MUNICIPAL,COLISAO,,S,,,,,,,,,,,0
170940,1496354,SINISTRO NAO FATAL,22/11/2022,2022,11,22,2022/11,18:39,SP 330,63.0,RODOVIAS,-23.162686051,-46.93049193,JUNDIAI,Campinas,,,1.0,,,,,,1.0,,,,CONCESSIONÁRIA,AUTOBAN,ESTADUAL,OUTROS,,,,,,,,,,S,,,0
168065,2323238,SINISTRO NAO FATAL,16/11/2022,2022,11,16,2022/11,07:58,RUA ATLANTICA,96.0,VIAS MUNICIPAIS,-23.563982369,-46.674064824,SAO PAULO,Metropolitana de São Paulo,,,,1.0,,,2.0,4.0,,,,,PREFEITURA,PREFEITURA,MUNICIPAL,ATROPELAMENTO,S,,,,,,,,,,S,,0
657879,2604543,SINISTRO NAO FATAL,05/05/2025,2025,5,5,2025/05,05:33,AVENIDA SANTOS DUMONT,1754.0,VIAS MUNICIPAIS,-23.9562464,-46.2901326,GUARUJA,Baixada Santista,,,1.0,,,,1.0,1.0,1.0,,,,PREFEITURA,PREFEITURA,MUNICIPAL,COLISAO,,,S,,,,,,,,,,0
398325,2071769,SINISTRO NAO FATAL,27/12/2023,2023,12,27,2023/12,09:50,SP 270,574.0,RODOVIAS,-22.1636891,-51.3822197,PRESIDENTE PRUDENTE,Presidente Prudente,,,1.0,,,,,,1.0,,,,CONCESSIONÁRIA,CART,ESTADUAL,OUTROS,,,,,,,,,,S,,,0
494873,2348731,SINISTRO NAO FATAL,20/06/2024,2024,6,20,2024/06,07:55,AVENIDA PRESIDENTE VARGAS,1.0,VIAS MUNICIPAIS,-20.532363,-47.396657,FRANCA,Franca,,,1.0,,,,1.0,1.0,1.0,,,,PREFEITURA,PREFEITURA,MUNICIPAL,COLISAO,,,,S,,,,,,,,,0
217917,1939401,SINISTRO NAO FATAL,23/02/2023,2023,2,23,2023/02,09:07,AVENIDA BOM JARDIM,110.0,VIAS MUNICIPAIS,-23.52583779,-46.61299935,SAO PAULO,Metropolitana de São Paulo,,,,,,1.0,1.0,1.0,1.0,,,,PREFEITURA,PREFEITURA,MUNICIPAL,COLISAO,,S,,,,,,,,,,,0
183000,1407888,NOTIFICACAO,14/12/2022,2022,12,14,2022/12,18:34,RUA DO TARRAF,10.0,VIAS MUNICIPAIS,-21.1678321398,-48.9745491721,CATANDUVA,São José do Rio Preto,,,,,,,,,,,,,PREFEITURA,PREFEITURA,MUNICIPAL,OUTROS,,,,,,,,,,,S,,0
122468,1965841,SINISTRO NAO FATAL,24/08/2022,2022,8,24,2022/08,09:43,AVENIDA EUROPA,2189.0,VIAS MUNICIPAIS,-22.72872363,-47.34592724,AMERICANA,Campinas,,,1.0,,,,1.0,1.0,,,,1.0,PREFEITURA,PREFEITURA,MUNICIPAL,CHOQUE,,,,,,,S,,,,,,1
633723,2571854,SINISTRO NAO FATAL,18/03/2025,2025,3,18,2025/03,08:27,RUA VEREADOR SILVA GROTA,229.0,VIAS MUNICIPAIS,-21.2004024,-50.433918,ARACATUBA,Araçatuba,,,,,,,,,,,,,PREFEITURA,PREFEITURA,MUNICIPAL,OUTROS,,,,,,,,,,,S,,0
585838,2428010,NOTIFICACAO,05/12/2024,2024,12,5,2024/12,22:43,RUA ALCÍDES COTRIM,15.0,VIAS MUNICIPAIS,-23.5452288,-46.9516834,ITAPEVI,Metropolitana de São Paulo,,,,,,,,,,,,,PREFEITURA,PREFEITURA,MUNICIPAL,OUTROS,,,,,,,,,,,S,,0
130160,1374417,SINISTRO NAO FATAL,07/09/2022,2022,9,7,2022/09,15:02,AVENIDA DOUTOR AFONSO VERGUEIRO,1300.0,VIAS MUNICIPAIS,-23.49570483,-47.46393542,SOROCABA,Sorocaba,,,1.0,,,,1.0,1.0,1.0,,,,PREFEITURA,PREFEITURA,MUNICIPAL,COLISAO,,,,S,,,,,,,S,,0
441576,1707359,NOTIFICACAO,17/03/2024,2024,3,17,2024/03,18:13,SP 055,100.0,RODOVIAS,-23.84059225,-46.3756999,CUBATAO,Baixada Santista,,,,,,,,,,,,,DER,05.04,ESTADUAL,OUTROS,,,,,,,,,,,S,,0
23280,2087528,SINISTRO NAO FATAL,21/02/2022,2022,2,21,2022/02,09:57,RUA LUIS GAMA,899.0,VIAS MUNICIPAIS,-23.56215904,-46.62155354,SAO PAULO,Metropolitana de São Paulo,,,1.0,1.0,,,1.0,2.0,1.0,,,,PREFEITURA,PREFEITURA,MUNICIPAL,COLISAO,,,,S,,,,,,,S,,0
556100,2415899,SINISTRO NAO FATAL,10/10/2024,2024,10,10,2024/10,18:43,RUA MACHADO FLORENCE,1.0,VIAS MUNICIPAIS,-22.9780413,-49.8646521,OURINHOS,Marília,,,,1.0,,,,1.0,,,,,PREFEITURA,PREFEITURA,MUNICIPAL,ATROPELAMENTO,S,,,,,,,,,,S,,0
195889,1651563,NOTIFICACAO,10/01/2023,2023,1,10,2023/01,23:09,AVENIDA RICIERI CHIQUETO,970.0,VIAS MUNICIPAIS,-23.08600277,-46.98005416,LOUVEIRA,Campinas,,,,,,,,,,,,,PREFEITURA,PREFEITURA,MUNICIPAL,OUTROS,,,,,,,,,,,S,,0
526375,2381351,SINISTRO NAO FATAL,17/08/2024,2024,8,17,2024/08,16:42,AVENIDA ARICANDUVA,12935.0,VIAS MUNICIPAIS,-23.59788,-46.4674805,SAO PAULO,Metropolitana de São Paulo,,,,2.0,,,,1.0,,,,,PREFEITURA,PREFEITURA,MUNICIPAL,OUTROS,,,,,,,,,,,S,S,0
261092,1307893,SINISTRO NAO FATAL,13/05/2023,2023,5,13,2023/05,13:05,AVENIDA ITARARÉ,914.0,VIAS MUNICIPAIS,-23.30400598,-46.73924374,FRANCO DA ROCHA,Metropolitana de São Paulo,,,,2.0,,,,1.0,1.0,,,,PREFEITURA,PREFEITURA,MUNICIPAL,COLISAO,,,,S,,,,,,,S,,0
637812,2565766,SINISTRO NAO FATAL,27/03/2025,2025,3,27,2025/03,20:24,RUA AMADO DUARTE SILVA,3085.0,VIAS MUNICIPAIS,-20.85100631,-49.40835765,SAO JOSE DO RIO PRETO,São José do Rio Preto,,,,,,,,,,,,,PREFEITURA,PREFEITURA,MUNICIPAL,COLISAO,,,,S,,,,,,,,,0
516165,2490271,SINISTRO FATAL,30/07/2024,2024,7,30,2024/07,20:50,SP 088,40.9,RODOVIAS,-23.4454593682,-46.2498546728,MOGI DAS CRUZES,Metropolitana de São Paulo,,,,,,,1.0,2.0,,1.0,,,CONCESSIONÁRIA,NOVO LITORAL,ESTADUAL,OUTROS,,,,,,,,S,,,,S,1
416677,2031092,SINISTRO NAO FATAL,02/02/2024,2024,2,2,2024/02,09:42,AVENIDA AFFONSO PENNA,442.0,VIAS MUNICIPAIS,-23.9680677,-46.3068465,SANTOS,Baixada Santista,,,1.0,1.0,,,,,,,,1.0,PREFEITURA,PREFEITURA,MUNICIPAL,OUTROS,,,,,,,,,,S,,,1
121144,1568443,NOTIFICACAO,22/08/2022,2022,8,22,2022/08,19:04,RUA ANFREDO JORGE PULINHO PORTUGAL,221.0,VIAS MUNICIPAIS,-23.038447,-45.56476722,TAUBATE,São José dos Campos,,,,,,,,,,,,,PREFEITURA,PREFEITURA,MUNICIPAL,OUTROS,,,,,,,,,,,S,S,0
406131,2055068,SINISTRO NAO FATAL,12/01/2024,2024,1,12,2024/01,09:00,AVENIDA TIRADENTES,2263.0,VIAS MUNICIPAIS,-23.460217,-46.5230129,GUARULHOS,Metropolitana de São Paulo,,,,1.0,,,,1.0,,,,,PREFEITURA,PREFEITURA,MUNICIPAL,OUTROS,,,,,,,,,,,S,S,0
24624,2142150,SINISTRO NAO FATAL,24/02/2022,2022,2,24,2022/02,14:00,JOSE EGIDIO DA FONSECA,10.0,VIAS MUNICIPAIS,-23.28503387,-47.29470873,ITU,Sorocaba,,,,,,,3.0,3.0,,,,,PREFEITURA,PREFEITURA,MUNICIPAL,CHOQUE,,,,,,,S,,,,,,0
547670,2400978,SINISTRO NAO FATAL,25/09/2024,2024,9,25,2024/09,07:35,AVENIDA INOCÊNCIO SERÁFICO,3023.0,VIAS MUNICIPAIS,-23.5478878,-46.8342807,CARAPICUIBA,Metropolitana de São Paulo,,,1.0,1.0,,,1.0,1.0,1.0,,,,PREFEITURA,PREFEITURA,MUNICIPAL,COLISAO,,S,,,,,,,,,S,,0
543971,2395863,SINISTRO NAO FATAL,19/09/2024,2024,9,19,2024/09,18:19,AVENIDA DO CURSINO,2943.0,VIAS MUNICIPAIS,-23.6274838,-46.6189676,SAO PAULO,Metropolitana de São Paulo,,,1.0,1.0,,,1.0,2.0,1.0,,,,PREFEITURA,PREFEITURA,MUNICIPAL,COLISAO,,,,S,,,,,,,S,,0
222386,1752337,SINISTRO NAO FATAL,04/03/2023,2023,3,4,2023/03,21:01,VIA CLITO BASTIA,580.0,VIAS MUNICIPAIS,-21.623781,-48.32849829,MATAO,Central,,,1.0,,,,1.0,1.0,1.0,,,,PREFEITURA,PREFEITURA,MUNICIPAL,COLISAO,,,S,S,,,,,,,,,0
431541,1697388,SINISTRO NAO FATAL,29/02/2024,2024,2,29,2024/02,22:06,NO TREVO PRINCIPAL,1.0,RODOVIAS,-20.20250015,-50.93906071,SANTA FE DO SUL,São José do Rio Preto,,,,1.0,,,1.0,1.0,,,,1.0,NAO DISPONIVEL,NAO DISPONIVEL,ESTADUAL,ATROPELAMENTO,S,,,,,,,,,,,,1
390304,1374705,NOTIFICACAO,15/12/2023,2023,12,15,2023/12,01:06,AVENIDA DOUTORA RUTH CARDOSO,1390.0,VIAS MUNICIPAIS,-23.5507667,-46.7248169,SAO PAULO,Metropolitana de São Paulo,,,,,,,,,,,,,PREFEITURA,PREFEITURA,MUNICIPAL,OUTROS,,,,,,,,,,,S,,0
551123,2442610,SINISTRO NAO FATAL,01/10/2024,2024,10,1,2024/10,08:37,RUA JOSÉ BONIFÁCIO,1.0,VIAS MUNICIPAIS,-21.2090149,-50.4251226,ARACATUBA,Araçatuba,,,,2.0,,,,1.0,,,,,PREFEITURA,PREFEITURA,MUNICIPAL,OUTROS,,,,,,,,,,,S,,0
331587,1981518,SINISTRO NAO FATAL,06/09/2023,2023,9,6,2023/09,09:26,AVENIDA PAULISTA,0.0,VIAS MUNICIPAIS,-23.5395512,-46.33024528,SUZANO,Metropolitana de São Paulo,,,,1.0,,,2.0,2.0,1.0,,,,PREFEITURA,PREFEITURA,MUNICIPAL,ATROPELAMENTO,S,,,,,,S,,,,,,0
259468,1341285,SINISTRO NAO FATAL,11/05/2023,2023,5,11,2023/05,15:50,AVENIDA ANTONIO PASCHOAL,1973.0,VIAS MUNICIPAIS,-21.14106965,-47.99056283,SERTAOZINHO,Ribeirão Preto,,,1.0,,,,1.0,,1.0,,,,PREFEITURA,PREFEITURA,MUNICIPAL,COLISAO,,,,S,,,,,,,,,0
442327,1616923,NOTIFICACAO,19/03/2024,2024,3,19,2024/03,19:48,AVENIDA MIGUEL NEVES DE AZEVEDO,10.0,VIAS MUNICIPAIS,-20.75519,-49.33697,SAO JOSE DO RIO PRETO,São José do Rio Preto,,,,,,,,,,,,,PREFEITURA,PREFEITURA,MUNICIPAL,OUTROS,,,,,,,,,,,S,,0
200739,2165460,NOTIFICACAO,20/01/2023,2023,1,20,2023/01,12:38,RUA PEDROSO DA SILVA,659.0,VIAS MUNICIPAIS,-23.4855504,-46.43271941,SAO PAULO,Metropolitana de São Paulo,,,,,,,,,,,,,PREFEITURA,PREFEITURA,MUNICIPAL,ATROPELAMENTO,S,,,,,,,,,,,S,0
623625,2556891,SINISTRO NAO FATAL,25/02/2025,2025,2,25,2025/02,12:11,ESTR U,638.0,VIAS MUNICIPAIS,-23.580861,-46.430028,SAO PAULO,Metropolitana de São Paulo,,,,,,,,,,,,,PREFEITURA,PREFEITURA,MUNICIPAL,COLISAO,,S,,,,,,,,,,,0
195166,1794754,SINISTRO NAO FATAL,08/01/2023,2023,1,8,2023/01,22:01,RUA AUGUSTO FARINA,1125.0,VIAS MUNICIPAIS,-23.58005066,-46.74196125,SAO PAULO,Metropolitana de São Paulo,,,2.0,,,,,,,,,2.0,PREFEITURA,PREFEITURA,MUNICIPAL,COLISAO,,,,S,,,,,,,S,,1
356552,2049948,SINISTRO NAO FATAL,19/10/2023,2023,10,19,2023/10,00:00,BR 116,230.6,RODOVIAS,-23.496549055,-46.5568496135,SAO PAULO,Metropolitana de São Paulo,,,1.0,,,,1.0,1.0,,,,,CONCESSIONÁRIA,NOVADUTRA,FEDERAL,COLISAO,,,,S,,,,,,,,,0
188641,1813345,SINISTRO NAO FATAL,24/12/2022,2022,12,24,2022/12,20:38,RUA MARIA HELENA,451.0,VIAS MUNICIPAIS,-23.68896836,-46.586186939,DIADEMA,Metropolitana de São Paulo,,,1.0,,,,1.0,1.0,1.0,,,,PREFEITURA,PREFEITURA,MUNICIPAL,COLISAO,,S,,,,,,,,,,,0
602983,2526741,SINISTRO NAO FATAL,11/01/2025,2025,1,11,2025/01,10:22,SP 340,206.0,RODOVIAS,-22.05176236,-47.02934291,AGUAI,Campinas,,1.0,,,,1.0,,,1.0,,,,CONCESSIONÁRIA,RENOVIAS,ESTADUAL,OUTROS,,,,,,,,,,S,,,0
478263,2335306,NOTIFICACAO,22/05/2024,2024,5,22,2024/05,13:18,RUA JOSÉ DE PAULA LATTANZIO,1.0,VIAS MUNICIPAIS,-22.007602,-47.8652025,SAO CARLOS,Central,,,,,,,,,,,,,PREFEITURA,PREFEITURA,MUNICIPAL,OUTROS,,,,,,,,,,,S,,0
272123,1295014,SINISTRO NAO FATAL,31/05/2023,2023,5,31,2023/05,16:56,NA FRENTE DA FACULDADE FAEFI,100.0,VIAS MUNICIPAIS,-22.22040438,-49.65042543,GARCA,Marília,,,1.0,,,,,,1.0,,,,PREFEITURA,PREFEITURA,MUNICIPAL,OUTROS,,,,,,,,,,,S,,0
506214,2267258,SINISTRO NAO FATAL,11/07/2024,2024,7,11,2024/07,15:58,ALAMEDA QUINZE DE DEZEMBRO,100.0,VIAS MUNICIPAIS,-22.9488851,-46.5281742,BRAGANCA PAULISTA,Campinas,,,1.0,,,,1.0,1.0,1.0,,,,PREFEITURA,PREFEITURA,MUNICIPAL,COLISAO,,,S,,,,,,,,,,0
393815,2177182,SINISTRO NAO FATAL,20/12/2023,2023,12,20,2023/12,12:29,RUA AMARAL GURGEL,126.0,VIAS MUNICIPAIS,-22.29560454,-48.55610147,JAU,Bauru,,,1.0,,,,1.0,1.0,1.0,,,,PREFEITURA,PREFEITURA,MUNICIPAL,COLISAO,,,,S,,,,,,,,,0
112929,1806141,SINISTRO NAO FATAL,07/08/2022,2022,8,7,2022/08,19:28,ACESSO P/ RODA VALDOMIRO CORREA DE CAMARGO,57.0,VIAS MUNICIPAIS,-23.3468295,-47.30740158,ITU,Sorocaba,,,1.0,,,,,1.0,,,,1.0,PREFEITURA,PREFEITURA,MUNICIPAL,OUTROS,,,,,,,,,,S,,,1
635923,2566361,NOTIFICACAO,23/03/2025,2025,3,23,2025/03,16:07,AVENIDA DAS NACOES UNIDAS,100.0,VIAS MUNICIPAIS,-22.4716188,-46.6306919,AGUAS DE LINDOIA,Campinas,,,,,,,,,,,,,PREFEITURA,PREFEITURA,MUNICIPAL,OUTROS,,,,,,,,,,,S,,0
100591,1299249,SINISTRO NAO FATAL,15/07/2022,2022,7,15,2022/07,13:08,AVENIDA SANTA CRUZ,3255.0,VIAS MUNICIPAIS,-20.54399647,-47.39172552,FRANCA,Franca,1.0,,,,,,1.0,1.0,1.0,,,,PREFEITURA,PREFEITURA,MUNICIPAL,ATROPELAMENTO,S,,,,,,,,,,,,0
425887,1951060,SINISTRO NAO FATAL,19/02/2024,2024,2,19,2024/02,07:16,AKZO NOBEL,3635.0,VIAS MUNICIPAIS,-231278.0,-47008.0,ITUPEVA,Campinas,,,,2.0,,,,1.0,,,,,PREFEITURA,PREFEITURA,MUNICIPAL,OUTROS,,,,,,,,,,,S,,0
331666,2240190,SINISTRO NAO FATAL,06/09/2023,2023,9,6,2023/09,12:49,AVENIDA GENERAL FRANCISCO MORAZAN,27.0,VIAS MUNICIPAIS,-23.592222,-46.731457,SAO PAULO,Metropolitana de São Paulo,,,,,,,1.0,5.0,1.0,,,,PREFEITURA,PREFEITURA,MUNICIPAL,ATROPELAMENTO,S,S,S,S,,,,,,,,,0
132379,1815286,SINISTRO NAO FATAL,11/09/2022,2022,9,11,2022/09,22:24,AVENIDA DOS AUTONOMISTAS,3030.0,VIAS MUNICIPAIS,-23.52684106,-46.7956354,OSASCO,Metropolitana de São Paulo,,,,,1.0,,2.0,4.0,,,,,PREFEITURA,PREFEITURA,MUNICIPAL,COLISAO,,S,S,S,,,,,S,,,,0
189128,1817694,NOTIFICACAO,25/12/2022,2022,12,25,2022/12,17:11,SP 330,0.0,RODOVIAS,-22.9326844502,-47.0741738051,CAMPINAS,Campinas,,,,,,,,,,,,,CONCESSIONÁRIA,AUTOBAN,ESTADUAL,OUTROS,,,,,,,,,,,S,,0
237698,2090280,SINISTRO NAO FATAL,01/04/2023,2023,4,1,2023/04,00:17,AVENIDA ADELIA CHOHFI,944.0,VIAS MUNICIPAIS,-23.61398818,-46.47582879,SAO PAULO,Metropolitana de São Paulo,,,,,,,2.0,1.0,1.0,,,,PREFEITURA,PREFEITURA,MUNICIPAL,COLISAO,,,,,S,,,,,,S,,0
265978,1303175,NOTIFICACAO,21/05/2023,2023,5,21,2023/05,10:02,RUA VISCONDE DE SÃO LEOPOLDO,52.0,VIAS MUNICIPAIS,-23.93443412,-46.32973223,SANTOS,Baixada Santista,,,,,,,,,,,,,PREFEITURA,PREFEITURA,MUNICIPAL,OUTROS,,,,,,,,,,,S,S,0
113839,1847056,NOTIFICACAO,09/08/2022,2022,8,9,2022/08,07:31,RUA INDIO PERY,727.0,VIAS MUNICIPAIS,-23.46281687,-46.64841748,SAO PAULO,Metropolitana de São Paulo,,,,,,,,,1.0,,,,PREFEITURA,PREFEITURA,MUNICIPAL,ATROPELAMENTO,S,,,,,,,,,,,,0
460059,1710886,NOTIFICACAO,20/04/2024,2024,4,20,2024/04,20:04,ESTRADA CARLOS LOPES GUEDES FILHO,1.0,VIAS MUNICIPAIS,-22.9443045,-45.4999208,PINDAMONHANGABA,São José dos Campos,,,,,,,,,,,,,PREFEITURA,PREFEITURA,MUNICIPAL,OUTROS,,,,,,,,,,,S,S,0
606092,2555570,SINISTRO NAO FATAL,18/01/2025,2025,1,18,2025/01,00:00,BR 101,52.0,RODOVIAS,-23.4562796264,-45.0710571488,UBATUBA,São José dos Campos,,,,,,,,,,,,,DNIT,DNIT,FEDERAL,COLISAO,,,,,S,,,,,,,,0
484833,2276423,NOTIFICACAO,03/06/2024,2024,6,3,2024/06,01:12,SP 332,51.0,RODOVIAS,-23.2852229,-46.7997111,JUNDIAI,Campinas,,,,,,,,,1.0,,,,NAO DISPONIVEL,NAO DISPONIVEL,ESTADUAL,NAO DISPONIVEL,,,,,,,,,,,,S,0
549757,2400614,SINISTRO NAO FATAL,29/09/2024,2024,9,29,2024/09,17:00,RUA ADELAÍDE TINARELE,990.0,VIAS MUNICIPAIS,-20.45144479,-50.88077146,APARECIDA D OESTE,São José do Rio Preto,,,,,,,2.0,1.0,2.0,,,,PREFEITURA,PREFEITURA,MUNICIPAL,COLISAO,,S,,S,,,,,,,,,0
459979,2260947,NOTIFICACAO,20/04/2024,2024,4,20,2024/04,11:05,R SETE,100.0,VIAS MUNICIPAIS,-21.85787038,-50.69787964,IACRI,Marília,,,,,,,,,,,,,PREFEITURA,PREFEITURA,MUNICIPAL,NAO DISPONIVEL,,,,,,,,,,,,S,0
215180,2225264,NOTIFICACAO,17/02/2023,2023,2,17,2023/02,13:28,AVENIDA SANTA CRUZ,238.0,VIAS MUNICIPAIS,-23.5142262,-47.49299938,SOROCABA,Sorocaba,,,,,,,,,,,,,PREFEITURA,PREFEITURA,MUNICIPAL,NAO DISPONIVEL,,,,,,,,,,,,S,0
430522,2542889,SINISTRO NAO FATAL,27/02/2024,2024,2,27,2024/02,00:00,RUA ARMANDO PERALLI,85.0,VIAS MUNICIPAIS,-233116.0,-459666.0,JACAREI,São José dos Campos,,,,1.0,,,,1.0,,,,,PREFEITURA,PREFEITURA,MUNICIPAL,OUTROS,,,,,,,,,,,S,,0
19990,2230992,NOTIFICACAO,15/02/2022,2022,2,15,2022/02,13:07,RUA MARIO TOTTA,450.0,VIAS MUNICIPAIS,-23.6888362,-46.78935553,SAO PAULO,Metropolitana de São Paulo,,,,,,,,1.0,,,,,PREFEITURA,PREFEITURA,MUNICIPAL,COLISAO,,S,,,,,,,,,,,0
480273,2273784,SINISTRO NAO FATAL,25/05/2024,2024,5,25,2024/05,15:56,SP 419,1.0,RODOVIAS,-21.5908435,-50.1692484,ALTO ALEGRE,Araçatuba,,,,,,,1.0,,2.0,,,,DER,11.02,ESTADUAL,OUTROS,,,,,,,,S,,,,,0
528221,2375217,SINISTRO NAO FATAL,20/08/2024,2024,8,20,2024/08,16:00,SPA 248/055,268.0,RODOVIAS,-23.9658332,-46.2715773,GUARUJA,Baixada Santista,,,1.0,,,,,,1.0,,,,DER,05.04,ESTADUAL,OUTROS,,,,,,,,,,,S,,0
415643,1866320,SINISTRO NAO FATAL,31/01/2024,2024,1,31,2024/01,07:26,SP 330,157.0,RODOVIAS,-22.5780675,-47.3666833,LIMEIRA,Campinas,,,1.0,,,,,,,,,1.0,CONCESSIONÁRIA,AUTOBAN,ESTADUAL,OUTROS,,,,,,,,,,S,S,,1
181213,2212139,NOTIFICACAO,10/12/2022,2022,12,10,2022/12,09:39,RUA JOSÉ ANTÔNIO DE CAMPOS,12.0,VIAS MUNICIPAIS,-24.4962733526,-47.8406672167,REGISTRO,Registro,,,,,,,,,,,,,PREFEITURA,PREFEITURA,MUNICIPAL,OUTROS,,,,,,,,,,,S,,0
670775,2595973,NOTIFICACAO,29/05/2025,2025,5,29,2025/05,15:35,RUA ARANDU,1.0,VIAS MUNICIPAIS,-23.6115603,-46.69362,SAO PAULO,Metropolitana de São Paulo,,,,,,,,,,,,,PREFEITURA,PREFEITURA,MUNICIPAL,NAO DISPONIVEL,,,,,,,,,,,,S,0
171465,1646371,SINISTRO NAO FATAL,23/11/2022,2022,11,23,2022/11,22:30,AVENIDA GABRIELA MISTRAL,873.0,VIAS MUNICIPAIS,-23.5136075552,-46.5506300544,SAO PAULO,Metropolitana de São Paulo,,,1.0,1.0,,,,,1.0,,,,PREFEITURA,PREFEITURA,MUNICIPAL,COLISAO,,,,S,,,,,,,S,,0
62094,2497382,SINISTRO FATAL,06/05/2022,2022,5,6,2022/05,06:55,SP 215,4.2,RODOVIAS,-21.8438546054,-46.7144589083,AGUAS DA PRATA,Campinas,,,1.0,,,,1.0,,,1.0,,,DER,13.04,ESTADUAL,COLISAO,,S,,,,,,,,,,S,1
572269,2435519,NOTIFICACAO,09/11/2024,2024,11,9,2024/11,22:33,AVENIDA SAPOPEMBA,11490.0,VIAS MUNICIPAIS,-23.6143903,-46.4983345,SAO PAULO,Metropolitana de São Paulo,,,,,,,,,,,,,PREFEITURA,PREFEITURA,MUNICIPAL,NAO DISPONIVEL,,,,,,,,,,,,S,0
66377,1316698,SINISTRO NAO FATAL,13/05/2022,2022,5,13,2022/05,16:24,RUA SÃO BENTO,880.0,VIAS MUNICIPAIS,-21.60200536,-46.87939017,SAO JOSE DO RIO PARDO,Campinas,,,1.0,1.0,,,1.0,1.0,1.0,,,,PREFEITURA,PREFEITURA,MUNICIPAL,COLISAO,,,,S,,,,,,,S,,0
322555,1375904,SINISTRO NAO FATAL,22/08/2023,2023,8,22,2023/08,12:05,AVENIDA SAPOPEMBA,13302.0,VIAS MUNICIPAIS,-23.61132583,-46.48358842,SAO PAULO,Metropolitana de São Paulo,,,1.0,,,,1.0,1.0,1.0,,,,PREFEITURA,PREFEITURA,MUNICIPAL,COLISAO,,,S,,,,,,,,,,0
93568,1522654,SINISTRO NAO FATAL,02/07/2022,2022,7,2,2022/07,14:24,RUA PASCOAL DA COSTA,277.0,VIAS MUNICIPAIS,-23.49843701,-46.69262451,SAO PAULO,Metropolitana de São Paulo,,,1.0,,,,1.0,1.0,1.0,,,,PREFEITURA,PREFEITURA,MUNICIPAL,COLISAO,,S,,,,,,,,,,,0
303049,1435118,NOTIFICACAO,20/07/2023,2023,7,20,2023/07,18:12,RUA RICIERI PUNHALL,1.0,VIAS MUNICIPAIS,-21.228357,-50.442844,ARACATUBA,Araçatuba,,,,,,,,,,,,,PREFEITURA,PREFEITURA,MUNICIPAL,OUTROS,,,,,,,,,,,S,,0
534942,2407117,SINISTRO NAO FATAL,02/09/2024,2024,9,2,2024/09,12:06,RUA SALVADOR ROMEU,249.0,VIAS MUNICIPAIS,-23.4957674,-46.6083859,SAO PAULO,Metropolitana de São Paulo,,1.0,,,,,1.0,1.0,1.0,,,,PREFEITURA,PREFEITURA,MUNICIPAL,COLISAO,,S,,,S,,,,,,S,,0
76954,1992669,SINISTRO NAO FATAL,01/06/2022,2022,6,1,2022/06,10:39,RUA BARÃO DE COTEGIPE,710.0,VIAS MUNICIPAIS,-21.17020326,-47.82131617,RIBEIRAO PRETO,Ribeirão Preto,,,,1.0,,,,1.0,,,,,PREFEITURA,PREFEITURA,MUNICIPAL,OUTROS,,,,,,,,,,,S,,0
553537,2450879,SINISTRO NAO FATAL,05/10/2024,2024,10,5,2024/10,08:59,AVENIDA DEPUTADO CANTÍDIO SAMPAIO,6557.0,VIAS MUNICIPAIS,-23.4350824,-46.716571,SAO PAULO,Metropolitana de São Paulo,,,1.0,,,,,,1.0,,,,PREFEITURA,PREFEITURA,MUNICIPAL,COLISAO,,S,,,,,,,,,,,0
417910,1319650,NOTIFICACAO,04/02/2024,2024,2,4,2024/02,09:36,RUA JOÃO JOSÉ PINTO,100.0,VIAS MUNICIPAIS,-23.4159135,-47.031401,PIRAPORA DO BOM JESUS,Metropolitana de São Paulo,,,,,,,,,,,,,PREFEITURA,PREFEITURA,MUNICIPAL,OUTROS,,,,,,,,,,,S,,0
546746,2407838,NOTIFICACAO,23/09/2024,2024,9,23,2024/09,13:13,AVENIDA SÃO PAULO,465.0,VIAS MUNICIPAIS,-22.41417864,-49.40316224,DUARTINA,Bauru,,,,,,,,,,,,,PREFEITURA,PREFEITURA,MUNICIPAL,OUTROS,,,,,,,,,,,S,,0
313005,1830569,NOTIFICACAO,05/08/2023,2023,8,5,2023/08,01:54,SP 348,80.0,RODOVIAS,-23.04303243,-47.06094958,CAMPINAS,Campinas,,,,,,,,,,,,,CONCESSIONÁRIA,AUTOBAN,ESTADUAL,OUTROS,,,,,,,,,,,S,S,0
519692,2388945,SINISTRO NAO FATAL,05/08/2024,2024,8,5,2024/08,10:40,AVENIDA ALBINO JOSÉ BARBOSA DE OLIVEIRA,100.0,VIAS MUNICIPAIS,-22.8226602,-47.0804352,CAMPINAS,Campinas,,,,,,,3.0,2.0,2.0,,,,PREFEITURA,PREFEITURA,MUNICIPAL,COLISAO,,S,S,,,,,,,,S,,0
171649,1820286,SINISTRO NAO FATAL,23/11/2022,2022,11,23,2022/11,07:09,AVENIDA DEPUTADO CANTIDIO SAMPAIO,6500.0,VIAS MUNICIPAIS,-23.4355057834,-46.7157276758,SAO PAULO,Metropolitana de São Paulo,,,,1.0,,,,,2.0,,,,PREFEITURA,PREFEITURA,MUNICIPAL,ATROPELAMENTO,S,,,,,,,,,,S,,0
109527,1436423,SINISTRO NAO FATAL,01/08/2022,2022,8,1,2022/08,16:57,ACESSO SANTOS DUMOND,1503.0,VIAS MUNICIPAIS,-23.97359916,-46.27594181,GUARUJA,Baixada Santista,,,1.0,,,,1.0,1.0,1.0,,,,PREFEITURA,PREFEITURA,MUNICIPAL,COLISAO,,S,S,,,,,,,,,,0
394117,1435001,NOTIFICACAO,21/12/2023,2023,12,21,2023/12,17:19,AVENIDA SÃO JOÃO,975.0,VIAS MUNICIPAIS,-23.12651389,-46.58154904,ATIBAIA,Campinas,,,,,,,,,,,,,PREFEITURA,PREFEITURA,MUNICIPAL,OUTROS,,,,,,,,,,,S,,0
157031,1687007,SINISTRO NAO FATAL,27/10/2022,2022,10,27,2022/10,22:01,ALAMEDA QUINZE DE DEZEMBRO,10.0,VIAS MUNICIPAIS,-22.9524662,-46.5289055,BRAGANCA PAULISTA,Campinas,,,1.0,,,,,1.0,1.0,,,,PREFEITURA,PREFEITURA,MUNICIPAL,ATROPELAMENTO,S,,,,,,,,,,,,0
317132,1563196,NOTIFICACAO,13/08/2023,2023,8,13,2023/08,14:05,RUA ILCE DA CUNHA HENRY,100.0,VIAS MUNICIPAIS,-23.03074768,-47.14057383,CAMPINAS,Campinas,,,,,,,,,,,,,PREFEITURA,PREFEITURA,MUNICIPAL,OUTROS,,,,,,,,,,,S,,0
90413,2492623,SINISTRO FATAL,26/06/2022,2022,6,26,2022/06,05:50,SP 261,145.0,RODOVIAS,-22.3467669218,-48.7544129051,PEDERNEIRAS,Bauru,,,,,,,2.0,1.0,,1.0,,,DER,03.02,ESTADUAL,COLISAO,,S,,,,,,,,,,S,1
301497,1627413,SINISTRO NAO FATAL,17/07/2023,2023,7,17,2023/07,22:14,RUA MARINGÁ,170.0,VIAS MUNICIPAIS,-23.672817,-46.801723,EMBU DAS ARTES,Metropolitana de São Paulo,,,1.0,1.0,,,1.0,2.0,1.0,,,,PREFEITURA,PREFEITURA,MUNICIPAL,COLISAO,,S,,,,,,,,,S,,0
65889,1475700,SINISTRO NAO FATAL,12/05/2022,2022,5,12,2022/05,19:38,RUA DOUTOR SILVIO DE CAMARGO,140.0,VIAS MUNICIPAIS,-22.34734111,-46.94028948,MOGI GUACU,Campinas,,,1.0,,,,1.0,1.0,1.0,,,,PREFEITURA,PREFEITURA,MUNICIPAL,COLISAO,,,,S,,,,,,,,,0
532374,2384858,SINISTRO NAO FATAL,29/08/2024,2024,8,29,2024/08,08:06,AVENIDA PADRE PIO CORSO,1.0,VIAS MUNICIPAIS,-21.707186,-47.4847707,SANTA RITA DO PASSA QUATRO,Central,,,2.0,,,,,,1.0,,,2.0,PREFEITURA,PREFEITURA,MUNICIPAL,COLISAO,,,,S,,,,,,,,,1
366197,1745913,SINISTRO NAO FATAL,04/11/2023,2023,11,4,2023/11,01:40,AVENIDA PADROEIRA DO BRASIL,1441.0,VIAS MUNICIPAIS,-22.8289645,-45.2124808,GUARATINGUETA,São José dos Campos,,,,1.0,,,,1.0,,,,,PREFEITURA,PREFEITURA,MUNICIPAL,OUTROS,,,,,,,,,,,S,,0
274127,1774491,NOTIFICACAO,03/06/2023,2023,6,3,2023/06,19:08,AVENIDA PRESIDENTE CASTELO BRANCO,11642.0,VIAS MUNICIPAIS,-24.05799221,-46.54047528,PRAIA GRANDE,Baixada Santista,,,,,,,,,,,,,PREFEITURA,PREFEITURA,MUNICIPAL,NAO DISPONIVEL,,,,,,,,,,,,S,0
357291,1928004,SINISTRO NAO FATAL,20/10/2023,2023,10,20,2023/10,09:14,AVENIDA PINTOS,1432.0,VIAS MUNICIPAIS,-21.264132,-48.3233661,JABOTICABAL,Ribeirão Preto,,,1.0,,,,1.0,2.0,1.0,,,,PREFEITURA,PREFEITURA,MUNICIPAL,COLISAO,,S,,,,,,,,,,,0
212614,2207352,SINISTRO NAO FATAL,12/02/2023,2023,2,12,2023/02,00:19,SP 270,16.0,RODOVIAS,-23.58420653,-46.78624679,SAO PAULO,Metropolitana de São Paulo,,,,,,,1.0,,3.0,,,,DER,10.02,ESTADUAL,CHOQUE,,,,,,,S,,,,,,0
359794,2221009,SINISTRO NAO FATAL,24/10/2023,2023,10,24,2023/10,14:03,AVENIDA CALIM EID,1565.0,VIAS MUNICIPAIS,-23.5205527,-46.4973971,SAO PAULO,Metropolitana de São Paulo,,,,1.0,,,,1.0,,,,,PREFEITURA,PREFEITURA,MUNICIPAL,OUTROS,,,,,,,,,,,S,,0
516285,2309310,SINISTRO NAO FATAL,30/07/2024,2024,7,30,2024/07,06:35,SP 015,1400.0,RODOVIAS,-23.5704898,-46.7028973,SAO PAULO,Metropolitana de São Paulo,,,1.0,,,,1.0,2.0,1.0,,,,NAO DISPONIVEL,NAO DISPONIVEL,ESTADUAL,COLISAO,,,S,,,,,,,,,,0
184527,1267639,NOTIFICACAO,16/12/2022,2022,12,16,2022/12,15:03,RUA RIO GRANDE DO SUL,0.0,VIAS MUNICIPAIS,-21.15954992,-47.814801724,RIBEIRAO PRETO,Ribeirão Preto,,,,,,,,,,,,,PREFEITURA,PREFEITURA,MUNICIPAL,OUTROS,,,,,,,,,,,S,,0
355302,1336676,SINISTRO NAO FATAL,17/10/2023,2023,10,17,2023/10,19:03,AVENIDA ITAMARATI,78.0,VIAS MUNICIPAIS,-23.6472589,-46.5244731,SANTO ANDRE,Metropolitana de São Paulo,,,1.0,,,,1.0,2.0,1.0,,,,PREFEITURA,PREFEITURA,MUNICIPAL,COLISAO,,,,S,,,,,,,,,0
202019,1772986,SINISTRO NAO FATAL,22/01/2023,2023,1,22,2023/01,19:30,SP 055,313.0,RODOVIAS,-24.1567785,-46.7440228,MONGAGUA,Baixada Santista,,,1.0,,,,1.0,1.0,1.0,,,1.0,ARTESP,NOVO LITORAL,ESTADUAL,COLISAO,,,,S,,,,,,S,,,1
216040,1729512,SINISTRO NAO FATAL,19/02/2023,2023,2,19,2023/02,01:06,RUA VOLUNTARIOS DA PATRIA,100.0,VIAS MUNICIPAIS,-23.51746141,-46.62794485,SAO PAULO,Metropolitana de São Paulo,,,1.0,1.0,,,,,1.0,,,,PREFEITURA,PREFEITURA,MUNICIPAL,COLISAO,,,,S,,,,,,,S,,0
